"meeting_date","project_id","title","borough","lead_agency","secondary_agency","public_private","project_type","construction_type","result","review_cycles","previous_year_submission"
"2022-09-12T00:00:00.000","22870","Installation of rooftop HVAC equipment, skylights and doors, and adjacent site work, Headworks Building, Tallman Island Wastewater Resource Recovery Facility, 127th Street and Powell's Cove Boulevard, College Point, Queens","Queens","DEP",,"Public","Building systems & Modifications","Installation of specific elements","Approved","1",
"2022-09-12T00:00:00.000","22846","Installation of decorative tree guards, West Side Federation for Senior and Supportive Housing, 141-145 West 108th Street, Manhattan","Manhattan","DPR",,"Public","Street furniture","Installation of specific elements","Approved","1",
"2022-09-12T00:00:00.000","20937","Rehabilitation of a comfort station, Grove Hill Playground, adjacent to P.S. 157, East 158th Street between Eagle Avenue and Cauldwell Avenue, Bronx","Bronx","DPR",,"Public","Architecture","Rehabilitation","Commented",,
"2022-09-12T00:00:00.000","22809","Installation of signage (New York Blood Center), 30 Flatbush Avenue, Brooklyn","Brooklyn","HPD",,"Public","Signage","Installation of specific elements","Commented",,
"2022-09-12T00:00:00.000","12489","Reconstruction of Gate Houses No. 2 and 3 and rehabilitation of Gate Houses No. 5 and 7, Jerome Park Reservoir, Sedgwick Avenue, Goulden Avenue and Reservoir Avenue, Bronx","Bronx","DEP",,"Public","Architecture","Reconstruction","Commented",,
"2022-09-12T00:00:00.000","22852","Installation of rooftop mechanical equipment, Rescue 1, 530 West 43rd Street, Manhattan","Manhattan","FDNY",,"Public","Building systems & Modifications","Installation of specific elements","Approved","1",
"2022-09-12T00:00:00.000","22856","Installation of rooftop mechanical units, 100th Police Precinct, 92-24 Rockaway Beach Boulevard, Rockaway Beach, Queens","Queens","NYPD",,"Public","Building systems & Modifications","Installation of specific elements","Approved","1",
"2022-09-12T00:00:00.000","22842","Reconstruction of the esplanade and adjacent site work (Lower Manhattan Coastal Resiliency), The Battery, Battery Place, State Street, Peter Minuit Plaza, and Upper New York Bay, Manhattan","Manhattan","EDC","DPR","Public","Landscape architecture","Reconstruction","Approved with conditions","2",
"2022-09-12T00:00:00.000","22865","Rehabilitation of the east façade, Bellevue Men's Shelter, 400 East 30th Street, Manhattan","Manhattan","DDC","DHS","Public","Building systems & Modifications","Rehabilitation","Approved","1",
"2022-09-12T00:00:00.000","22807","Construction of flood protection measures and moveable planters as part of the South Battery Park City Resiliency master plan, 1st Place between Battery Place and the Battery Park City Esplanade, Manhattan","Manhattan","DOT",,"Public","Landscape architecture","Construction","Approved","3",
"2022-09-12T00:00:00.000","22855","Installation of a fenced-in area with stairs and a wheelchair lift, 202 St. Nicholas Avenue, Manhattan","Manhattan","DOT",,"Public","Landscape architecture","Installation of specific elements","Approved","1",
"2022-09-12T00:00:00.000","21647","Reconstruction of the coastline (East Side Coastal Resiliency) and East River Park, including the construction of three bridges, a comfort station, two recreation centers, and two gate houses, East River between Montgomery Street and East 25th Street, Manhattan","Manhattan","DDC","DOT/DPR","Public","Landscape architecture","Reconstruction","Commented",,
"2022-09-12T00:00:00.000","22847","Conservation and relocation of the Washington Kill Von Kull Monument (1932), Faber Park, Richmond Terrace between Sharpe Avenue and Faber Street, Staten Island","Staten Island","DPR",,"Public","Artwork","Conservation","Approved","1",
"2022-09-12T00:00:00.000","22869","Rehabilitation of the Hudson River Drainage Chamber and adjacent site work, Breakneck Point, Town of Fishkill, Dutchess County","Upstate","DEP",,"Public","Architecture","Rehabilitation","Approved with conditions","1",
"2022-09-12T00:00:00.000","22848","Reconstruction of the playground, Hamilton Fish Park, Pitt Street, East Houston Street, and Sheriff Street, Manhattan","Manhattan","DPR",,"Public","Landscape architecture","Reconstruction","Approved","1",
"2022-09-12T00:00:00.000","22511","Construction of ADA ramps and restoration of the Conservatory Garden, Phase II, Central Park, Fifth Avenue at East 105th Street, Manhattan","Manhattan","DPR","CPC","Public","Landscape architecture","Construction","Commented",,
"2022-09-12T00:00:00.000","22867","Construction of a residential building, streetscape, and plazas 126th Street and Roosevelt Avenue, Willets Point, Corona, Queens","Queens","EDC",,"Public","Architecture","Construction","Commented",,
"2022-09-12T00:00:00.000","18612","Reconstruction of a park, Elizabeth H. Berger Plaza, Greenwich Street, Edgar Street, Trinity Place, and Morris Street, Manhattan","Manhattan","DPR",,"Public","Landscape architecture","Reconstruction","Commented",,
"2022-09-12T00:00:00.000","22117","Construction of a public health laboratory, Harlem Hospital Center, Lenox Avenue, West 137th Street, Fifth Avenue, and West 136th Street, Manhattan","Manhattan","EDC",,"Public","Architecture","Construction","Commented",,
"2022-09-12T00:00:00.000","22872","Installation of signage (Primark), CityPoint, 1 Dekalb Avenue (445 Albee Square West), Fleet Street, Albee Square, and Albee Square West, Brooklyn","Brooklyn","EDC",,"Private","Signage","Installation of specific elements","Approved","1",
"2022-09-12T00:00:00.000","19902","Construction of a playground, plaza, and adjacent site work, Faber Park, Richmond Terrace between Sharpe Avenue and Faber Street, Staten Island","Staten Island","DPR",,"Public","Landscape architecture","Construction","Commented",,
"2022-09-12T00:00:00.000","16468","Installation of a permanent perimeter fence, Newtown Creek Wastewater Pollution Control Plant, Provost Street, Greenpoint Avenue, and Kingsland Avenue, Brooklyn","Brooklyn","DEP",,"Public","Landscape architecture","Installation of specific elements","Commented",,
"2022-09-12T00:00:00.000","22853","Installation of a conduit support system, Final Settling Tanks, Red Hook Wastewater Resource Recovery Facility, West Street between East Way and Little Street, Brooklyn Navy Yard Industrial Park, Brooklyn","Brooklyn","DEP",,"Public","Building systems & Modifications","Installation of specific elements","Approved","1",
"2022-09-12T00:00:00.000","17094","Reconstruction of Lawrence Playground, College Point Boulevard, Botanical Garden Bridge, and the Van Wyck Expressway, Queens","Queens","DPR",,"Public","Landscape architecture","Reconstruction","Commented",,
"2022-09-12T00:00:00.000","22871","Installation of a modular comfort station and adjacent site work, Discovery Playground, Fort Washington Park, Henry Hudson Parkway near West 163rd Street, Manhattan","Manhattan","DPR",,"Public","Architecture","Installation of specific elements","Commented",,
"2022-09-12T00:00:00.000","22223","Reconstruction of a swimming pool and skating rink (Lasker Rink) and adjacent site work, between East Drive and the Harlem Meer, Central Park, Manhattan","Manhattan","DPR","CPC","Public","Landscape architecture","Reconstruction","Commented",,
"2022-09-12T00:00:00.000","20462","Reconstruction of the roof, Ozone Park Branch Library, 92-24 Rockaway Boulevard, Ozone Park, Queens","Queens","DDC","QL","Public","Building systems & Modifications","Reconstruction","Commented",,
"2022-09-12T00:00:00.000","22858","Rehabilitation of a comfort station, Little Flower Playground, Madison Street, Jefferson Street, and Cherry Street, Manhattan","Manhattan","DPR",,"Public","Architecture","Rehabilitation","Approved","1",
"2022-09-12T00:00:00.000","22136","Reconstruction of Pershing Square East Plaza, Park Avenue between East 41st Street and East 42nd Street, Manhattan","Manhattan","DDC","DOT","Public","Landscape architecture","Reconstruction","Commented",,
"2022-09-12T00:00:00.000","21088","Design of a wayfinding and environmental graphics system, Brooklyn Navy Yard Industrial Park, Brooklyn","Brooklyn","BNYDC",,"Public","Signage","Master plan/Prototype","Withdrawn",,
"2022-08-08T00:00:00.000","20419","Installation of rooftop mechanical equipment, Engine Company 24, 227 Sixth Avenue, Manhattan","Manhattan","FDNY",,"Public","Building systems & Modifications","Installation of specific elements","Commented",,
"2022-08-08T00:00:00.000","17170","Construction of the Mary Cali Dalton Recreation Center, 6 Victory Boulevard, adjacent to at the Lyons Pool, Hannah Street, Murray Hulbert Avenue, and the Tompkinsville Esplanade, Staten Island","Staten Island","DDC","DPR","Public","Architecture","Construction","Commented",,
"2022-08-08T00:00:00.000","20310","Installation of rooftop photovoltaic panels, Emergency Medical Station 45 (EMS 45), 58-65 52nd Road, Woodside, Queens","Queens","FDNY",,"Public","Building systems & Modifications","Installation of specific elements","Commented",,
"2022-08-08T00:00:00.000","17064","Reconstruction of Bloomingdale Playground, Amsterdam Avenue between West 104th Street and West 105th Street, Manhattan","Manhattan","DPR",,"Public","Landscape Architecture","Reconstruction","Commented",,
"2022-08-08T00:00:00.000","20803","Reconstruction of Babi Yar Triangle, Corbin Place, Ocean View Avenue, and Brighton 14th Street, Brooklyn","Brooklyn","DPR",,"Public","Landscape architecture","Reconstruction","Commented",,
"2022-08-08T00:00:00.000","21647","Reconstruction of the coastline (East Side Coastal Resiliency) and East River Park, including the construction of three bridges, a comfort station, two recreation centers, and two gate houses, East River between Montgomery Street and East 25th Street, Manhattan","Manhattan","DDC","DPR/DEP","Public","Landscape Architecture","Reconstruction","Withdrawn",,
"2022-08-08T00:00:00.000","22821","Upgrade of Hillview Reservoir, 100 Central Park Avenue, Yonkers, Westchester County","Upstate","DEP",,"Public","Architecture","Renovation","Approved with conditions","1",
"2022-08-08T00:00:00.000","20421","Installation of windows, louvers, and mechanical equipment, Emergency Medical Station 20 (EMS 20), 1400 Pelham Parkway South, Bronx","Bronx","FDNY",,"Public","Building systems & Modifications","Installation of specific elements","Commented",,
"2022-08-08T00:00:00.000","21489","Design of electric vehicle charging stations for installation citywide","Citywide","DOT",,"Public","Street furniture","Master plan/Prototype","Commented",,
"2022-08-08T00:00:00.000","21529","Reconstruction of a portion of Osborn Playground, Osborn Street between Hegeman Avenue and Linden Boulevard, Brooklyn","Brooklyn","DPR",,"Public","Landscape architecture","Reconstruction","Commented",,
"2022-08-08T00:00:00.000","20307","Construction of a carport and installation of photovoltaic panels, Engine Company 332, 165 Bradford Street, Brooklyn","Brooklyn","FDNY",,"Public","Building systems & Modifications","Construction","Commented",,
"2022-08-08T00:00:00.000","21647","Reconstruction of the coastline (East Side Coastal Resiliency) and East River Park, including the construction of three bridges, a comfort station, two recreation centers, and two gate houses, East River between Montgomery Street and East 25th Street, Manhattan","Manhattan","DDC","DOT/DPR","Public","Landscape Architecture","Reconstruction","Commented",,
"2022-08-08T00:00:00.000","22826","Reconstruction of a multipurpose play area, adjacent to P.S. 68, Evergreen Park, St. Felix Place, Seneca Avenue, and 75th Avenue, Ridgewood, Queens","Queens","DPR",,"Public","Landscape architecture","Reconstruction","Approved","1",
"2022-08-08T00:00:00.000","22561","Reconstruction of the Brooklyn Detention Complex, 275 Atlantic Avenue, Brooklyn","Brooklyn","DDC",,"Public","Architecture","Reconstruction","Withdrawn",,
"2022-08-08T00:00:00.000","22840","Reconstruction of eight electrical vault buildings, Flushing Meadows Corona Park, Corona, Queens","Queens","DPR",,"Public","Architecture","Reconstruction","Commented",,
"2022-08-08T00:00:00.000","22841","Construction of a prototypical comfort station, Flushing Meadows Corona Park, Corona, Queens","Queens","DPR",,"Public","Architecture","Construction","Commented",,
"2022-08-08T00:00:00.000","22836","Installation of prototypical public communications structures (Link5G) in Residence Zoning and Historic Districts citywide","Citywide","OTI",,"Public and Private","Street furniture","Installation of specific elements","Approved with conditions","1",
"2022-08-08T00:00:00.000","22843","Conservation of the Alice and Friends mural series","Citywide","HHC",,"Public","Artwork","Conservation","Commented",,
"2022-08-08T00:00:00.000","22837","Construction of an environmental learning center (Solar 2) and adjacent site work, 24-20 FDR Drive at Peter Cooper Road, Manhattan","Manhattan","EDC",,"Public and Private","Architecture","Construction","Commented",,
"2022-08-08T00:00:00.000","22828","Relocation and conservation of the Emma Lazarus memorial plaque, as part of the Lower Manhattan Coastal Resiliency, The Battery, between Castle Clinton and Pier A, Manhattan","Manhattan","DPR","EDC","Public","Artwork","Relocation","Approved","1",
"2022-08-08T00:00:00.000","22825","Reconstruction of Rivington Street Playground, Sara D. Roosevelt Park, Forsyth Street, extension of Rivington Street, and Chrystie Street, Manhattan","Manhattan","DPR",,"Public","Landscape architecture","Reconstruction","Approved with conditions","1",
"2022-08-08T00:00:00.000","22823","Installation of an ADA ramp, 1310 West Farms Road, Bronx","Bronx","DOT",,"Public","Building systems & Modifications","Installation of specific elements","Approved","1",
"2022-08-08T00:00:00.000","22818","Construction of an amphitheater as part of East Side Coastal Resiliency (ESCR), Jackson Street, Cherry Street, and the FDR Drive, East River Park, Manhattan","Manhattan","DDC","DPR","Public","Architecture","Construction","Withdrawn",,
"2022-08-08T00:00:00.000","22833","Installation of rooftop mechanical units, 100th Police Precinct, 92-24 Rockaway Beach Boulevard, Rockaway Beach, Queens","Queens","NYPD",,"Public","Building systems & Modifications","Installation of specific elements","Approved","1",
"2022-08-08T00:00:00.000","22810","Reconstruction of a salt shed and interim compost facility as part of the Gowanus Canal combined sewer overflow facility, 2nd Avenue and 6th Street, Brooklyn","Brooklyn","DEP","DSNY","Public","Architecture","Reconstruction","Approved","1",
"2022-08-08T00:00:00.000","22778","Installation of Resonances by Christopher Myers, Brownsville Library, 61 Glenmore Avenue, Brooklyn","Brooklyn","DCLA%","DDC","Public","Artwork","Installation of specific elements","Approved with conditions","1",
"2022-08-08T00:00:00.000","22783","Reconstruction of a pier shed and head house for film studios and adjacent site work, Pier 94, 711 12th Avenue between West 52nd Street and West 55th Street, Hudson River, Manhattan","Manhattan","EDC",,"Public and Private","Architecture","Reconstruction","Approved with conditions","2",
"2022-08-08T00:00:00.000","22430","Construction of a parking garage and community facility as part of the Borough-Based Jails Program, Union Turnpike between 126th Street and 132nd Street, Kew Gardens, Queens","Queens","DDC","DOT","Public","Architecture","Construction","Commented",,
"2022-08-08T00:00:00.000","22817","Installation of doors and louvers, Building 50, Fifth Street, Ordinance Avenue, and Flushing Avenue, Brooklyn Navy Yard Industrial Park, Brooklyn","Brooklyn","BNYDC",,"Private","Building systems & Modifications","Installation of specific elements","Approved","1",
"2022-08-08T00:00:00.000","22834","Installation of rooftop mechanical equipment, Langston Hughes Community Library and Cultural Center, 100-01 Northern Boulevard, Corona, Queens","Queens","QL",,"Public","Building systems & Modifications","Installation of specific elements","Approved","1",
"2022-08-08T00:00:00.000","20403","Construction of a garden entrance and adjacent site work, Dag Hammarskjold Plaza, East 47th between 1st Avenue and 2nd Avenue, Manhattan","Manhattan","DPR",,"Public","Landscape architecture","Construction","Commented",,
"2022-08-08T00:00:00.000","21088","Design of a wayfinding and environmental graphics system, Brooklyn Navy Yard Industrial Park, Brooklyn","Brooklyn","BNYDC",,"Public","Signage","Master plan/Prototype","Commented",,
"2022-08-08T00:00:00.000","7695","Rehabilitation of the Olmsted Center, including adjacent site work, Flushing Meadows Corona Park, Queens","Queens","DPR",,"Public","Architecture","Rehabilitation","Commented",,
"2022-08-08T00:00:00.000","21848","Installation of rooftop photovoltaic panels, Building 12, Reilly Boulevard between Sears Street and Kelly Street, Randall's Island, Manhattan","Manhattan","FDNY",,"Public","Building systems & Modifications","Installation of specific elements","Commented",,
"2022-08-08T00:00:00.000","22430","Construction of a parking garage and community facility as part of the Borough-Based Jails Program, Union Turnpike between 126th Street and 132nd Street, Kew Gardens, Queens","Queens","DDC","DOT","Public","Distinctive lighting","Construction","Withdrawn",,
"2022-08-08T00:00:00.000","22784","Construction of Engine Company 287/Ladder 136/Battalion 46, 86-53 Grand Avenue, Elmhurst, Queens","Queens","FDNY",,"Public","Architecture","Construction","Approved with conditions","2",
"2022-08-08T00:00:00.000","22832","Conservation of Private Passage (2005) by Malcolm Cochran, Hudson River Park, Clinton Cove, between 12th Avenue and the Hudson River at West 56th Street, Manhattan","Manhattan","HRPT","DPR","Public","Artwork","Conservation","Approved","1",
"2022-08-08T00:00:00.000","22822","Construction of a fenced-in area, 234 North 9th Street, Brooklyn","Brooklyn","DOT",,"Public and Private","Landscape architecture","Construction","Approved","1",
"2022-08-08T00:00:00.000","22812","Reconstruction of William McCray Playground, 138th Street between Fifth Avenue and Lenox Avenue, Manhattan","Manhattan","DPR",,"Public","Landscape architecture","Reconstruction","Approved","1",
"2022-08-08T00:00:00.000","22725","Reconstruction of an operations facility, relocation of a playground, and adjacent site work, Coney Island Beach Operations Headquarters, Poseidon Playground, 3026 West 25th Street, West 27th Street, Surf Avenue, West 25th Street, and The Riegelmann Boardwalk, Brooklyn","Brooklyn","DDC","DPR","Public","Architecture","Reconstruction","Commented",,
"2022-08-08T00:00:00.000","22830","Installation of a louver, Engine Company 299/Ladder Company 152, 61-20 Utopia Parkway, Fresh Meadows, Queens","Queens","FDNY",,"Public","Building systems & Modifications","Installation of specific elements","Approved","1",
"2022-08-08T00:00:00.000","22787","Installation of three paintings by Jessica Alazraki, Bronx Animal Care Center, 2050 Bartow Avenue at Co-Op City Boulevard, Bronx","Bronx","DCLA%","DDC","Public","Artwork","Installation of specific elements","Approved","2",
"2022-08-08T00:00:00.000","21422","Installation of rooftop photovoltaic panels, Special Operations Command, 750 Main Street, Roosevelt Island, Manhattan","Manhattan","FDNY",,"Public","Building systems & Modifications","Installation of specific elements","Commented",,
"2022-08-08T00:00:00.000","22819","Installation of rooftop mechanical equipment, windows, and doors, Hollis Branch Public Library, 202-05 Hillside Avenue, Queensborough, Queens","Queens","DDC","QL","Public","Building systems & Modifications","Installation of specific elements","Approved","1",
"2022-08-08T00:00:00.000","22827","Reconstruction of the Inwood Hill Ballfields, Inwood Hill Park, West 214th Street and Seaman Avenue, Manhattan","Manhattan","DPR",,"Public","Landscape architecture","Reconstruction","Approved","1",
"2022-08-08T00:00:00.000","22803","Reconstruction of the Cumberland Street Gate and Clinton Avenue Gate, and adjacent site work, Flushing Avenue at Cumberland Street and Sixth Street, and at Clinton Avenue and Tenth Avenue, Brooklyn Navy Yard Industrial Park, Brooklyn","Brooklyn","BNYDC",,"Public","Architecture","Reconstruction","Commented",,
"2022-08-08T00:00:00.000","22824","Construction of a plaza, Queensbridge Baby Park, Vernon Boulevard and Queensbridge Park Greenway, adjacent to the Queensboro Bridge, Long Island City, Queens","Queens","DPR",,"Public","Landscape architecture","Construction","Approved","1",
"2022-08-08T00:00:00.000","22371","Installation of Emanativ by Eto Otitigbe, Harlem River Greenway as part of the Manhattan Waterfront Greenway, Harlem River Drive between East 125th Street and East 132nd Street, Manhattan","Queens","EDC","DPR","Public","Artwork","Rehabilitation","Commented",,
"2022-08-08T00:00:00.000","22829","Reconstruction of the esplanade and installation of a barge, gangway, and electrical equipment to accommodate citywide ferry service, Hunters Point South Park, the East River and Center Boulevard between 54th Avenue and Borden Avenue, Long Island City, Queens","Queens","EDC","DPR","Public and Private","Landscape architecture","Reconstruction","Approved","1",
"2022-08-08T00:00:00.000","22842","Reconstruction of the esplanade and adjacent site work (Lower Manhattan Coastal Resiliency), The Battery, Battery Place, State Street, Peter Minuit Plaza, and the Upper New York Bay, Manhattan","Manhattan","EDC","DPR","Public","Landscape architecture","Reconstruction","Commented",,
"2022-08-08T00:00:00.000","22838","Construction of a flood wall and resiliency infrastructure, including a portion of the Brooklyn Waterfront Greenway (Red Hook Coastal Resiliency), from Summit Street at Hamilton Avenue to Ferris Street at Coffey Street, and to Halleck Street at Columbia Street, Brooklyn","Brooklyn","DDC","DEP/DPR/DOT","Public","Landscape architecture","Construction","Commented",,
"2022-08-08T00:00:00.000","22835","Installation of rooftop mechanical equipment, Steinway Branch Library, 21-45 31st Street, Astoria, Queens","Queens","QL",,"Public","Building systems & Modifications","Installation of specific elements","Approved","1",
"2022-08-08T00:00:00.000","22831","Installation of signage (7 Eleven), 395 Flatbush Avenue Extension, Brooklyn","Brooklyn","HPD",,"Private","Signage","Installation of specific elements","Approved","1",
"2022-08-08T00:00:00.000","22807","Installation of planters and flood protection measures as part of South Battery Park City Resiliency, 1st Place between Battery Place and the Battery Park City Esplanade, Manhattan","Manhattan","DOT",,"Public","Landscape architecture","Installation of specific elements","Commented",,
"2022-08-08T00:00:00.000","22744","Construction of the Bronx Detention Center, East 142nd Street between Concord Avenue and Southern Boulevard, Bronx","Bronx","DDC",,"Public","Architecture","Construction","Commented",,
"2022-08-08T00:00:00.000","22839","Reconstruction of the plaza, Queens Civil Court, 89-11 Sutphin Boulevard, Jamaica, Queens","Queens","DDC",,"Public","Landscape architecture","Reconstruction","Commented",,
"2022-08-08T00:00:00.000","22820","Installation of vent hoods and construction of an outfall connection as part of the Ashokan Century Program, Lower Gate Chamber, Ashokan Reservoir, Ulster County","Upstate","DEP",,"Public","Building systems & Modifications","Installation of specific elements","Approved","1",
"2022-07-11T00:00:00.000","22791","Installation of louvers, Pamoja House, 357 Marcus Garvey Boulevard, Brooklyn","Brooklyn","DDC","DHS","Public","Architecture","Installation of specific elements","Approved","1",
"2022-07-11T00:00:00.000","22803","Reconstruction of the Cumberland Street Gate and Clinton Avenue Gate, and adjacent site work, Flushing Avenue at Cumberland Street and Sixth Street, and at Clinton Avenue and Tenth Avenue, Brooklyn Navy Yard Industrial Park, Brooklyn","Brooklyn","BNYDC",,"Public","Architecture","Reconstruction","Commented",,
"2022-07-11T00:00:00.000","22793","Reconstruction of power centers 4 and 7 and installation of transformers, Wards Island Wastewater Resource Recovery Facility, Wards Island, Manhattan","Manhattan","DEP",,"Public","Architecture","Reconstruction","Approved","1",
"2022-07-11T00:00:00.000","22813","Reconstruction of Horseshoe Playground, Hall Place and Rogers Place, Bronx","Bronx","DPR",,"Public","Landscape architecture","Reconstruction","Approved","1",
"2022-07-11T00:00:00.000","22804","Construction of a maintenance building, a comfort station, and adjacent site work, as Phase II and Phase III of the construction of a waterfront park and streetscape improvements, Thompson Street, Wave Street and Bay Street, Stapleton, Staten Island","Staten Island","EDC","DPR","Public","Architecture","Construction","Approved","1",
"2022-07-11T00:00:00.000","22811","Reconstruction of a landscape, North Meadow Recreation Center, West Drive and 97th Street Transverse Road, Central Park, Manhattan","Manhattan","DPR","CPC","Public","Landscape architecture","Reconstruction","Approved","1",
"2022-07-11T00:00:00.000","22810","Reconstruction of a salt shed and interim compost facility as a part of the Gowanus Canal combined sewer overflow (CSO) facility, 2nd Avenue and 6th Street, Brooklyn","Brooklyn","DEP","DSNY","Public","Architecture","Reconstruction","Commented",,
"2022-07-11T00:00:00.000","22806","Installation of rooftop antennas (Verizon), 25 Waterside Plaza, Manhattan","Manhattan","HPD",,"Private","Building systems & Modifications","Installation of specific elements","Approved","1",
"2022-07-11T00:00:00.000","22059","Design of an interpretive sign, Newtown Creek Wastewater Resource Recovery Facility, 329 Greenpoint Avenue, Brooklyn","Brooklyn","DEP",,"Public","Signage","Master plan/Prototype","Commented",,
