"centername","legalname","building","street","borough","zipcode","phone","permitnumber","permitexp","status","agerange","maximumcapacity","dc_id","programtype","facilitytype","childcaretype","bin","url","datepermitted","actual","violationratepercent","violationavgratepercent","totaleducationalworkers","averagetotaleducationalworkers","publichealthhazardviolationrate","averagepublichealthhazardiolationrate","criticalviolationrate","avgcriticalviolationrate","inspectiondate","regulationsummary","violationcategory","healthcodesubsection","violationstatus","inspectionsummaryresult"
"JACKSON CHILDREN'S SERVICES, INC.","JACKSON CHILDREN'S SERVICES, INC.","88-23","31 AVENUE","QUEENS","11369","718-205-1919","105769","2024-08-10T00:00:00.000","Permitted","2 YEARS - 5 YEARS","30","DC40674","PRESCHOOL","GDC","Child Care - Pre School","4033431",,"2022-08-10T15:09:52.000","Y","50","21.905","7","11.9769","0","6.1285","50","18.9541","2022-12-07T00:00:00.000","At time of inspection floors/walls ceilings were observed Not maintained; in disrepair or covered in a toxic finish.","GENERAL","47.41(j)","OPEN","Initial Annual Inspection - Reinspection Not Required"
"JACKSON CHILDREN'S SERVICES, INC.","JACKSON CHILDREN'S SERVICES, INC.","88-23","31 AVENUE","QUEENS","11369","718-205-1919","105769","2024-08-10T00:00:00.000","Permitted","2 YEARS - 5 YEARS","30","DC40674","PRESCHOOL","GDC","Child Care - Pre School","4033431",,"2022-08-10T15:09:52.000","Y","50","21.905","7","11.9769","0","6.1285","50","18.9541","2022-12-07T00:00:00.000","At time of inspection floors/walls ceilings were observed Not maintained; in disrepair or covered in a toxic finish.","GENERAL","47.41(j)","OPEN","Initial Annual Inspection - Reinspection Not Required"
"ATERET TORAH CENTER","BET YAAKOV ATERET TORAH","2166","CONEY ISLAND AVENUE","BROOKLYN","11223","718-375-7100",,"2115-01-23T00:00:00.000","Active","3 YEARS - 5 YEARS","0","DC20651","PRESCHOOL","SBCC","School Based Child Care","3394079",,,,"50","45.1817","6","8.0094","0","23.3017","50","35.2291","2022-10-20T00:00:00.000","School-based child care staff observed caring for children while unhealthy. Staff medical certificate of fitness Not provided.","GENERAL","43.11(b)","OPEN","Initial Annual Inspection - Reinspection Required"
"PACKER SUMMER 2022","PACKER COLLEGIATE INSTITUTE","170","Joralemon Street","BROOKLYN","11201","718-250-0259","33693","2022-09-15T00:00:00.000","Expired-In Renewal","0 YEARS - 16 YEARS","300","DC23302","ALL AGE CAMP","Camp","Camp","3391484","www.packer.edu/summer","2013-05-14T00:00:00.000","N","0","26.8868","0","1","0","14.2558","0","21.8553","2022-06-22T00:00:00.000","There were no new violations observed at the time of this inspection/visit.",,,"N/A","Initial Annual Inspection - Passed inspection with no violations"
"THE LEARNING EXPERIENCE","RIVERDALE CHILDCARE EXPERIENCE, LLC","3210","Riverdale Avenue","BRONX","10463","718-708-5884","97738","2023-09-28T00:00:00.000","Permitted","2 YEARS - 5 YEARS","131","DC32914","PRESCHOOL","GDC","Child Care - Pre School","2083672","www.thelearningexperience.com","2015-09-28T00:00:00.000","Y",,,"26","11.9769",,,,,"2021-11-05T00:00:00.000","At time of inspection child care service unable to document that all children enrolled have had an age appropriate medical evaluation.","GENERAL","47.25(a)(1)","CORRECTED",
"THE LEARNING EXPERIENCE","RIVERDALE CHILDCARE EXPERIENCE, LLC","3210","Riverdale Avenue","BRONX","10463","718-708-5884","97738","2023-09-28T00:00:00.000","Permitted","2 YEARS - 5 YEARS","131","DC32914","PRESCHOOL","GDC","Child Care - Pre School","2083672","www.thelearningexperience.com","2015-09-28T00:00:00.000","Y",,,"26","11.9769",,,,,"2021-11-05T00:00:00.000","At time of inspection child care service unable to document that all children enrolled have had an age appropriate medical evaluation.","GENERAL","47.25(a)(1)","CORRECTED",
"KID KRAZY, INC.","KID KRAZY EARLY CHILDHOOD DEVELOPMENT CENTER ANNEX II","21-35","21 AVENUE","QUEENS","11105","718-545-5728","7278","2024-07-21T00:00:00.000","Permitted","2 YEARS - 5 YEARS","24","DC2276","PRESCHOOL","GDC","Child Care - Pre School","4447571","kidkrazypreschool.com","2003-12-16T00:00:00.000","Y","0","21.905","10","11.9769","0","6.1285","0","18.9541","2022-01-19T00:00:00.000","There were no new violations observed at the time of this inspection/visit.",,,"N/A","Initial Annual Inspection - Passed inspection with no violations"
"KID KRAZY, INC.","KID KRAZY EARLY CHILDHOOD DEVELOPMENT CENTER ANNEX II","21-35","21 AVENUE","QUEENS","11105","718-545-5728","7278","2024-07-21T00:00:00.000","Permitted","2 YEARS - 5 YEARS","24","DC2276","PRESCHOOL","GDC","Child Care - Pre School","4447571","kidkrazypreschool.com","2003-12-16T00:00:00.000","Y","0","21.905","10","11.9769","0","6.1285","0","18.9541","2022-01-19T00:00:00.000","There were no new violations observed at the time of this inspection/visit.",,,"N/A","Initial Annual Inspection - Passed inspection with no violations"
"BLOCK INSTITUTE SCHOOL","BLOCK INSTITUTE SCHOOL","376","BAY 44 STREET","BROOKLYN","11214","718-906-5400","6006","2024-01-28T00:00:00.000","Permitted","2 YEARS - 5 YEARS","208","DC10875","PRESCHOOL","GDC","Child Care - Pre School","3187874","blockinstitute.org","2004-11-09T00:00:00.000","N","33.3333","21.905","61","11.9769","0","6.1285","33.3333","18.9541","2021-05-19T00:00:00.000","There were no new violations observed at the time of this inspection/visit.",,,"N/A","Compliance Inspection of Open Violations - Passed inspection; Violations corrected at time of inspection"
"ALL MY CHILDREN DAY CARE & NURSERY SCHOOL","ALL MY CHILDREN DAY CARE & NURSERY SCHOOL","110","RIDGE STREET","MANHATTAN","10002","212-466-6262","73219","2024-09-11T00:00:00.000","Permitted","2 YEARS - 5 YEARS","59","DC31943","PRESCHOOL","GDC","Child Care - Pre School","1004096","www.allmychildrendaycare.com","2014-09-11T00:00:00.000","Y","0","21.905","8","11.9769","0","6.1285","0","18.9541","2022-07-07T00:00:00.000","There were no new violations observed at the time of this inspection/visit.",,,"N/A","Initial Annual Inspection - Passed inspection with no violations"
"THE NEW YORK INSTITUTE FOR SPECIAL EDUCATION","THE NEW YORK INSTITUTE FOR SPECIAL EDUCATION","985","ASTOR AVENUE","BRONX","10469","718-519-7000","5417","2024-06-28T00:00:00.000","Permitted","2 YEARS - 5 YEARS","147","DC14206","PRESCHOOL","GDC","Child Care - Pre School","2097375","www.nyise.org","1993-03-04T00:00:00.000","Y","50","21.905","31","11.9769","0","6.1285","50","18.9541","2023-03-07T00:00:00.000","At time of inspection floors/walls ceilings were observed Not maintained; in disrepair or covered in a toxic finish.","GENERAL","47.41(j)","OPEN","Compliance Inspection of Open Violations - Reinspection Not Required"
"THE NEW YORK INSTITUTE FOR SPECIAL EDUCATION","THE NEW YORK INSTITUTE FOR SPECIAL EDUCATION","985","ASTOR AVENUE","BRONX","10469","718-519-7000","5417","2024-06-28T00:00:00.000","Permitted","2 YEARS - 5 YEARS","147","DC14206","PRESCHOOL","GDC","Child Care - Pre School","2097375","www.nyise.org","1993-03-04T00:00:00.000","Y","50","21.905","31","11.9769","0","6.1285","50","18.9541","2023-03-07T00:00:00.000","At time of inspection floors/walls ceilings were observed Not maintained; in disrepair or covered in a toxic finish.","GENERAL","47.41(j)","OPEN","Compliance Inspection of Open Violations - Reinspection Not Required"
"ST. ANN'S  PRESCHOOL","ST. ANN'S PRE-SCHOOL","26","WILLOW PLACE","BROOKLYN","11201","718-624-2837",,"2115-01-23T00:00:00.000","Active","2 YEARS - 5 YEARS","70","DC1767","PRESCHOOL","SBCC","School Based Child Care","3002274","www.saintannsny.org",,,"0","45.1817","8","8.0094","0","23.3017","0","35.2291","2021-11-12T00:00:00.000","School-based child care staff observed caring for children while unhealthy. Staff medical certificate of fitness Not provided.","GENERAL","43.11(b)","CORRECTED","Initial Annual Inspection - Reinspection Not Required"
"POLIS","GUIDEPOST MONTESSORI AT MUSEUM MILE","12","EAST   79 STREET","MANHATTAN","10075","917-388-1710",,"1900-01-01T00:00:00.000","Active","3 YEARS - 5 YEARS","0","DC37702","PRESCHOOL","SBCC","School Based Child Care","1041889","polis.school",,,"50","45.1817","0","8.0094","0","23.3017","50","35.2291","2022-09-30T00:00:00.000","Child Medical record are DOHMH property when health care provider provided by DOHMH","GENERAL","43.17(f)","CORRECTED","Initial Annual Inspection - Reinspection Required"
"MONTESSORI PROGRESSIVE LEARNING CENTER, INC.","MONTESSORI PROGRESSIVE LEARNING CENTER INC","195-05","LINDEN BOULEVARD","QUEENS","11412","718-723-3967","7019","2024-05-07T00:00:00.000","Permitted","2 YEARS - 5 YEARS","76","DC10897","PRESCHOOL","GDC","Child Care - Pre School","4238357",,"2004-05-06T00:00:00.000","N","100","21.905","6","11.9769","0","6.1285","100","18.9541","2022-05-10T00:00:00.000","There were no new violations observed at the time of this inspection/visit.",,,"N/A",
"SPUYTEN DUYVIL PRESCHOOL, INC.","SPUYTEN DUYVIL PRESCHOOL, INC.","3041","KINGSBRIDGE AVENUE","BRONX","10463","718-549-1525","3088","2024-04-06T00:00:00.000","Permitted","2 YEARS - 5 YEARS","49","DC252","PRESCHOOL","GDC","Child Care - Pre School","2083194","www.spuytenduyvilpreschool.org","2004-04-01T00:00:00.000","N","0","21.905","13","11.9769","0","6.1285","0","18.9541","2023-04-05T00:00:00.000","Staff and volunteers obtain documentation showing immunization with 2 doses measles/mumps, 1 dose rubella, 2 doses varicella and 1 dose Tdap. Medical exemptions only. History of measles, mumps or rubella shall Not replace MMR vaccine except in presence of MMR varicella antibodies.","GENERAL","47.33(c)(1)","CORRECTED",
"UTOPIA CHILDREN'S  CENTER, INC.","UTOPIA CHILDREN'S CENTER, INC.","236","WEST 129 STREET","MANHATTAN","10027","212-663-7375","1594","2023-09-29T00:00:00.000","Permitted","2 YEARS - 5 YEARS","60","DC1323","PRESCHOOL","GDC","Child Care - Pre School","1081503",,"2002-05-01T00:00:00.000","N","40","21.905","6","11.9769","0","6.1285","40","18.9541","2023-03-09T00:00:00.000","There were no new violations observed at the time of this inspection/visit.",,,"N/A","Compliance Inspection of Open Violations - Passed inspection; Violations corrected at time of inspection"
"BRIGHT HORIZONS AT DUMBO","BRIGHT HORIZONS CHILDREN'S CENTERS, LLC.","60","WATER ST","BROOKLYN","11201","332-255-8599","104725","2025-01-31T00:00:00.000","Permitted","2 YEARS - 5 YEARS","86","DC37595","PRESCHOOL","GDC","Child Care - Pre School","3398406","www.brighthorizons.com","2019-01-31T13:21:13.000","Y","0","21.905","11","11.9769","0","6.1285","0","18.9541","2022-05-24T00:00:00.000","There were no new violations observed at the time of this inspection/visit.",,,"N/A","Initial Annual Inspection - Passed inspection with no violations"
"ST. ALBANS VACATION BIBLE SCHOOL","THE PRESBYTERIAN CHURCH OF ST. ALBANS","190-04","119 AVENUE","QUEENS","11412","347-551-2448","34594","2019-09-15T00:00:00.000","Expired-In Renewal","0 YEARS - 16 YEARS","31","DC23546","ALL AGE CAMP","Camp","Camp","4272513","www.preschurch.org","2013-07-01T00:00:00.000","N",,,"0","1",,,,,,,,,,
"CASTLETON HILL MORAVIAN CHURCH PRESCHOOL","UNITED BRETHREN'S CHURCH ON STATEN ISLAND","1657","VICTORY BOULEVARD","STATEN ISLAND","10314","718-442-5350","5125","2024-10-20T00:00:00.000","Permitted","2 YEARS - 5 YEARS","94","DC2811","PRESCHOOL","GDC","Child Care - Pre School","5089758","www.castletonhillpreschool.com","2004-10-20T00:00:00.000","N","16.6667","21.905","19","11.9769","0","6.1285","16.6667","18.9541","2021-10-27T00:00:00.000","At time of inspection it was determined that child care service allows staff to perform their duties that are Not healthy or are incapable of carrying out their duties. Staff medical clearances are Not maintained by child care service.","GENERAL","47.33(b)","CORRECTED","Initial Annual Inspection - Reinspection Required; Violations corrected at time of inspection"
"CASTLETON HILL MORAVIAN CHURCH PRESCHOOL","UNITED BRETHREN'S CHURCH ON STATEN ISLAND","1657","VICTORY BOULEVARD","STATEN ISLAND","10314","718-442-5350","5125","2024-10-20T00:00:00.000","Permitted","2 YEARS - 5 YEARS","94","DC2811","PRESCHOOL","GDC","Child Care - Pre School","5089758","www.castletonhillpreschool.com","2004-10-20T00:00:00.000","N","16.6667","21.905","19","11.9769","0","6.1285","16.6667","18.9541","2021-10-27T00:00:00.000","At time of inspection it was determined that child care service allows staff to perform their duties that are Not healthy or are incapable of carrying out their duties. Staff medical clearances are Not maintained by child care service.","GENERAL","47.33(b)","CORRECTED","Initial Annual Inspection - Reinspection Required; Violations corrected at time of inspection"
"THE NURTURING ACADEMY  INFANT/TODDLER","THE NURTURING CENTER INC.","112-18","SPRINGFIELD BLVD","QUEENS","11429","718-527-5932","8341","2024-11-17T00:00:00.000","Permitted","0 YEARS - 2 YEARS","36","DC21073","INFANT TODDLER","GDC","Child Care - Infants/Toddlers","4240268",,"2010-11-17T00:00:00.000","Y","33.3333","17.4391","16","8.4034","33.3333","4.9984","33.3333","15.3835","2022-02-17T00:00:00.000","At time of inspection floors/walls ceilings were observed Not maintained; in disrepair or covered in a toxic finish.","GENERAL","47.41(j)","CORRECTED","Initial Annual Inspection - Reinspection Required; Fines pending"
"KIDZ KORNER DAY CARE","KIDZ KORNER INC.","2422","RALPH AVENUE","BROOKLYN","11234","718-676-5200","7311","2022-09-30T00:00:00.000","Expired-In Renewal","2 YEARS - 5 YEARS","25","DC308","PRESCHOOL","GDC","Child Care - Pre School","3221460",,"2003-07-30T00:00:00.000","Y","16.6667","21.905","7","11.9769","16.6667","6.1285","0","18.9541","2022-06-08T00:00:00.000","There were no new violations observed at the time of this inspection/visit.",,,"N/A","Initial Annual Inspection - Passed inspection with no violations"
"Aleph Daycare Inc","Aleph Daycare Inc","975","E 13TH ST","BROOKLYN","11230","718-946-9833","105519","2023-09-30T00:00:00.000","Permitted","2 YEARS - 5 YEARS","105","DC40221","PRESCHOOL","GDC","Child Care - Pre School","3179572",,"2021-09-30T13:45:26.000","Y","0","21.905","7","11.9769","0","6.1285","0","18.9541","2022-09-15T00:00:00.000","There were no new violations observed at the time of this inspection/visit.",,,"N/A","Initial Annual Inspection - Passed inspection with no violations"
"A KIDS SPACE TO DREAM CHILDCARE","KIDS SPACE BRONX CHILDCARE INC","578","E 138TH ST","BRONX","10454","917-635-9709","105642","2024-05-19T00:00:00.000","Permitted","2 YEARS - 5 YEARS","60","DC40807","PRESCHOOL","GDC","Child Care - Pre School","2092841",,"2022-05-19T14:18:28.000","Y","100","21.905","14","11.9769","100","6.1285","100","18.9541","2022-02-22T00:00:00.000","At time of inspection lavatory facilities failed to be provided with child high/accessible toilets and sinks.","CRITICAL","47.43(f)","CORRECTED",
"GIFTED & TALENTED EARLY DEVELOPERS","GIFTED AND TALENTED EARLY DEVELOPERS, LLC","1621","CHURCH AVENUE","BROOKLYN","11226","718-693-3699","85077","2023-04-13T00:00:00.000","Expired-In Renewal","2 YEARS - 5 YEARS","47","DC21986","PRESCHOOL","GDC","Child Care - Pre School","3116477",,"2015-04-13T00:00:00.000","Y","25","21.905","12","11.9769","0","6.1285","25","18.9541","2023-01-27T00:00:00.000","At time of inspection child care service failed to provide sufficient lighting and or failed to maintain adequate foot candles in areas used by children.","GENERAL","47.45(b)","CORRECTED","Initial Annual Inspection - Reinspection Required"
"GIFTED & TALENTED EARLY DEVELOPERS","GIFTED AND TALENTED EARLY DEVELOPERS, LLC","1621","CHURCH AVENUE","BROOKLYN","11226","718-693-3699","85077","2023-04-13T00:00:00.000","Expired-In Renewal","2 YEARS - 5 YEARS","47","DC21986","PRESCHOOL","GDC","Child Care - Pre School","3116477",,"2015-04-13T00:00:00.000","Y","25","21.905","12","11.9769","0","6.1285","25","18.9541","2023-01-27T00:00:00.000","At time of inspection child care service failed to provide sufficient lighting and or failed to maintain adequate foot candles in areas used by children.","GENERAL","47.45(b)","CORRECTED","Initial Annual Inspection - Reinspection Required"
"GIFTED & TALENTED EARLY DEVELOPERS","GIFTED AND TALENTED EARLY DEVELOPERS, LLC","1621","CHURCH AVENUE","BROOKLYN","11226","718-693-3699","85077","2023-04-13T00:00:00.000","Expired-In Renewal","2 YEARS - 5 YEARS","47","DC21986","PRESCHOOL","GDC","Child Care - Pre School","3116477",,"2015-04-13T00:00:00.000","Y","25","21.905","12","11.9769","0","6.1285","25","18.9541","2023-01-27T00:00:00.000","At time of inspection child care service failed to provide sufficient lighting and or failed to maintain adequate foot candles in areas used by children.","GENERAL","47.45(b)","CORRECTED","Initial Annual Inspection - Reinspection Required"
"READY, SET, GROW! CHILD CARE CENTER, L.L.C","READY, SET, GROW! CHILD CARE CENTER L.L.C.","136-16","31 ROAD","QUEENS","11354","718-888-7871","8284","2025-03-28T00:00:00.000","Permitted",,"73","DC21750","PRESCHOOL","GDC","Child Care - Pre School","4308655",,"2011-03-28T00:00:00.000","Y","40","21.905","7","11.9769","40","6.1285","20","18.9541","2023-01-19T00:00:00.000","There were no new violations observed at the time of this inspection/visit.",,,"N/A","Initial Annual Inspection - Passed inspection with no violations"
"OUR KIDS PLACE COUNTRY DAY INC.","OUR KIDS PLACE COUNTRY DAY INC","137-25","BROOKVILLE BLVD","QUEENS","11422","718-276-3722","54337","2023-11-20T00:00:00.000","Permitted","2 YEARS - 5 YEARS","108","DC22806","PRESCHOOL","GDC","Child Care - Pre School","4438946","www.ourkidsplacecares.com","2013-11-20T00:00:00.000","Y","20","21.905","19","11.9769","0","6.1285","20","18.9541","2022-03-03T00:00:00.000","There were no new violations observed at the time of this inspection/visit.",,,"N/A","Initial Annual Inspection - Passed inspection with no violations"
"CANARSIE CHILDREN FIRST ACADEMY","Faith Children First Academy","3231","STEUBEN AVENUE","BRONX","10467","718-676-6260",,"1900-01-01T00:00:00.000","Active","3 YEARS - 5 YEARS","0","DC37690","PRESCHOOL","SBCC","School Based Child Care","2017732","www.facebook.com/ccfacademy",,,"100","45.1817","8","8.0094","50","23.3017","100","35.2291","2022-12-20T00:00:00.000","Each staff member has documentation showing they received 2 doses measles/mumps vaccine, 1 dose rubella vaccine, 2 doses varicella vaccine and 1 dose Tdap","GENERAL","43.11(c)(1)","CORRECTED","Initial Annual Inspection - Reinspection Required; Fines pending"
"CANARSIE CHILDREN FIRST ACADEMY","Faith Children First Academy","3231","STEUBEN AVENUE","BRONX","10467","718-676-6260",,"1900-01-01T00:00:00.000","Active","3 YEARS - 5 YEARS","0","DC37690","PRESCHOOL","SBCC","School Based Child Care","2017732","www.facebook.com/ccfacademy",,,"100","45.1817","8","8.0094","50","23.3017","100","35.2291","2022-12-20T00:00:00.000","Each staff member has documentation showing they received 2 doses measles/mumps vaccine, 1 dose rubella vaccine, 2 doses varicella vaccine and 1 dose Tdap","GENERAL","43.11(c)(1)","CORRECTED","Initial Annual Inspection - Reinspection Required; Fines pending"
"RENAISSANCE VILLAGE LLC.","RENAISSANCE VILLAGE LLC.","220","CABRINI BOULEVARD","MANHATTAN","10033","212-928-7855","7707","2023-02-02T00:00:00.000","Expired-In Renewal","2 YEARS - 5 YEARS","29","DC16889","PRESCHOOL","GDC","Child Care - Pre School","1064369","WWW.RENVILLAGE.COM","2007-02-02T00:00:00.000","Y","40","21.905","9","11.9769","0","6.1285","40","18.9541","2023-03-08T00:00:00.000","Training in SIDS, Shaken Baby Syndrome and Safe Sleep practices Not provided to staff","CRITICAL","47.37(b)(4)","CORRECTED","Initial Annual Inspection - Reinspection Required; Fines pending"
"SHINING SMILES DAYCARE 1 INC.","SHINING SMILES DAYCARE 1 INC","882","FULTON ST","BROOKLYN","11238","929-227-3100","104940","2023-07-09T00:00:00.000","Permitted","2 YEARS - 5 YEARS","59","DC37545","PRESCHOOL","GDC","Child Care - Pre School","3000000","www.nycshiningsmiles.com","2019-07-09T08:27:07.000","Y","33.3333","21.905","11","11.9769","0","6.1285","33.3333","18.9541","2023-03-23T00:00:00.000","There were no new violations observed at the time of this inspection/visit.",,,"N/A",
"BEANSTALK CHILD CARE ACADEMY","NYC EARLY LEARNING COMPANY, INC","950","Westchester Avenue","BRONX","10459","718-991-5465","104872","2023-06-13T00:00:00.000","Permitted","2 YEARS - 5 YEARS","108","DC36656","PRESCHOOL","GDC","Child Care - Pre School","2114693",,"2019-06-13T10:38:04.000","Y","50","21.905","76","11.9769","0","6.1285","50","18.9541","2022-04-07T00:00:00.000","Child care service fails to store dry goods in insect/rodent proof containers at time of inspection.","CRITICAL","47.61(e)","CORRECTED","Initial Annual Inspection - Reinspection Required; Fines pending"
"BEANSTALK CHILD CARE ACADEMY","NYC EARLY LEARNING COMPANY, INC","950","Westchester Avenue","BRONX","10459","718-991-5465","104872","2023-06-13T00:00:00.000","Permitted","2 YEARS - 5 YEARS","108","DC36656","PRESCHOOL","GDC","Child Care - Pre School","2114693",,"2019-06-13T10:38:04.000","Y","50","21.905","76","11.9769","0","6.1285","50","18.9541","2022-04-07T00:00:00.000","Child care service fails to store dry goods in insect/rodent proof containers at time of inspection.","CRITICAL","47.61(e)","CORRECTED","Initial Annual Inspection - Reinspection Required; Fines pending"
"BEANSTALK CHILD CARE ACADEMY","NYC EARLY LEARNING COMPANY, INC","950","Westchester Avenue","BRONX","10459","718-991-5465","104872","2023-06-13T00:00:00.000","Permitted","2 YEARS - 5 YEARS","108","DC36656","PRESCHOOL","GDC","Child Care - Pre School","2114693",,"2019-06-13T10:38:04.000","Y","50","21.905","76","11.9769","0","6.1285","50","18.9541","2022-04-07T00:00:00.000","Child care service fails to store dry goods in insect/rodent proof containers at time of inspection.","CRITICAL","47.61(e)","CORRECTED","Initial Annual Inspection - Reinspection Required; Fines pending"
"BEANSTALK CHILD CARE ACADEMY","NYC EARLY LEARNING COMPANY, INC","950","Westchester Avenue","BRONX","10459","718-991-5465","104872","2023-06-13T00:00:00.000","Permitted","2 YEARS - 5 YEARS","108","DC36656","PRESCHOOL","GDC","Child Care - Pre School","2114693",,"2019-06-13T10:38:04.000","Y","50","21.905","76","11.9769","0","6.1285","50","18.9541","2022-04-07T00:00:00.000","Child care service fails to store dry goods in insect/rodent proof containers at time of inspection.","CRITICAL","47.61(e)","CORRECTED","Initial Annual Inspection - Reinspection Required; Fines pending"
"BSDC INC","BSDC INC","66-07","ALDERTON STREET","QUEENS","11374","718-440-9919","105851","2024-10-03T00:00:00.000","Permitted","0 YEARS - 2 YEARS","15","DC41829","INFANT TODDLER","GDC","Child Care - Infants/Toddlers","4461930",,"2022-10-03T09:35:24.000","Y","0","17.4391","6","8.4034","0","4.9984","0","15.3835","2022-12-21T00:00:00.000","At time of inspection it was determined that child care service allows staff to perform their duties that are Not healthy or are incapable of carrying out their duties. Staff medical clearances are Not maintained by child care service.","GENERAL","47.33(b)","CORRECTED","Initial Annual Inspection - Reinspection Not Required"
"JOYFUL TOTS DAYCARE CENTER INC.","JOYFUL TOTS DAYCARE CENTER INC","265","LOTT AVENUE","BROOKLYN","11212","718-342-4225","55858","2024-01-09T00:00:00.000","Permitted","2 YEARS - 5 YEARS","48","DC25976","PRESCHOOL","GDC","Child Care - Pre School","3085658",,"2014-01-09T00:00:00.000","Y","0","21.905","4","11.9769","0","6.1285","0","18.9541","2022-02-14T00:00:00.000","There were no new violations observed at the time of this inspection/visit.",,,"N/A","Initial Annual Inspection - Passed inspection with no violations"
"UP THE LADDER CORP","UP THE LADDER CORP","80-11","101 AVENUE","QUEENS","11416","718-843-4913","7407","2023-07-08T00:00:00.000","Permitted","2 YEARS - 5 YEARS","28","DC14407","PRESCHOOL","GDC","Child Care - Pre School","4188129",,"2005-08-17T00:00:00.000","Y","25","21.905","3","11.9769","25","6.1285","0","18.9541","2023-03-16T00:00:00.000","Fingerprint screening Not arranged for current and prospective personnel; Results Not satisfactory or CAP was Not approved","PUBLIC HEALTH HAZARD","47.19(c)(1)","OPEN","Initial Annual Inspection - Reinspection Required; Fines pending"
"CHAI TOTS","The Rabbinical Committee of Brownstone Brooklyn (Chabad of Park Slope), Inc.","70","PROSPECT PARK WEST","BROOKLYN","11215","718-499-0836","7013","2024-04-18T00:00:00.000","Permitted",,"37","DC1554","PRESCHOOL","GDC","Child Care - Pre School","3025377","CHAITOTSPRESCHOOL.COM","2002-07-25T00:00:00.000","N","0","21.905","18","11.9769","0","6.1285","0","18.9541","2022-02-03T00:00:00.000","There were no new violations observed at the time of this inspection/visit.",,,"N/A","Initial Annual Inspection - Passed inspection with no violations"
"SALVE REGINA CATHOLIC ACADEMY","SALVE REGINA CATHOLIC ACADEMY","237","JEROME STREET","BROOKLYN","11207","718-277-9000",,"2117-08-29T00:00:00.000","Active","3 YEARS - 5 YEARS","0","DC22510","PRESCHOOL","SBCC","School Based Child Care","3327110",,,,"0","45.1817","9","8.0094","0","23.3017","0","35.2291","2021-12-14T00:00:00.000","School-based child care staff observed caring for children while unhealthy. Staff medical certificate of fitness Not provided.","GENERAL","43.11(b)","OPEN","Initial Annual Inspection - Reinspection Not Required"
"BRIGHT FUTURE KIDDIE 4","BRIGHT FUTURE KIDDIE4 LLC","3952","3RD AVE","BRONX","10457","347-963-4073","105592","2024-02-04T00:00:00.000","Permitted","2 YEARS - 5 YEARS","25","DC40549","PRESCHOOL","GDC","Child Care - Pre School","2119684",,"2022-02-04T10:34:05.000","Y","100","21.905","9","11.9769","50","6.1285","100","18.9541","2022-08-24T00:00:00.000","Child care service providing care without a staff member trained in First Aid/CPR on site at time of inspection.","CRITICAL","47.23(e)","CORRECTED","Initial Annual Inspection - Reinspection Required; Fines pending"
