"centername","legalname","building","street","borough","zipcode","phone","permitnumber","permitexp","status","agerange","maximumcapacity","dc_id","programtype","facilitytype","childcaretype","bin","url","datepermitted","actual","violationratepercent","violationavgratepercent","totaleducationalworkers","averagetotaleducationalworkers","publichealthhazardviolationrate","averagepublichealthhazardiolationrate","criticalviolationrate","avgcriticalviolationrate","inspectiondate","regulationsummary","violationcategory","healthcodesubsection","violationstatus","inspectionsummaryresult"
"SACRED HEART CATHOLIC ACADEMY","SACRED HEART CATHOLIC ACADEMY","84-05","78 AVENUE","QUEENS","11385","917-670-8917","105456","2021-09-15T00:00:00.000","Expired-In Renewal","6 YEARS - 16 YEARS","0","DC40320","SCHOOL AGE CAMP","Camp","Camp","4443218","www.sacredheart.org","2021-07-28T10:54:27.000","Y",,,"0","1",,,,,"2022-07-07T00:00:00.000","There were no new violations observed at the time of this inspection/visit.",,,"N/A",
"LITTLE SCHOLARS LEARNING CENTER IV","FLATBUSH DAYCARE LLC","4123","AVENUE U","BROOKLYN","11234","917-838-3482","104345","2024-03-07T00:00:00.000","Permitted","2 YEARS - 5 YEARS","68","DC33811","PRESCHOOL","GDC","Child Care - Pre School","3241899",,"2018-03-07T16:21:43.000","Y","75","21.905","11","11.9769","50","6.1285","50","18.9541","2021-07-07T00:00:00.000","Qualified Group Teacher Not designated to cover for Education Director. Permittee failed to Notify Department of separation from service of Education Director","CRITICAL","47.13(c)(1)","CORRECTED","Monitoring Inspection Non-Routine - Reinspection Required; Fines pending"
"CHINESE-AMERICAN PLANNING COUNCIL, INC.","CHINESE-AMERICAN PLANNING COUNCIL, INC.","108","AVENUE D","MANHATTAN","10009","212-533-9138","6408","2024-01-09T00:00:00.000","Permitted","2 YEARS - 5 YEARS","60","DC14345","PRESCHOOL","GDC","Child Care - Pre School","1077507","cpc-nyc.org","2004-01-07T00:00:00.000","N","0","21.905","7","11.9769","0","6.1285","0","18.9541","2020-11-12T00:00:00.000","There were no new violations observed at the time of this inspection/visit.",,,"N/A","Initial Annual Inspection - Passed inspection with no violations"
"LEEBLING, INC.","Leebling, inc.","1349","47 STREET","BROOKLYN","11219","718-484-8714","104615","2024-10-04T00:00:00.000","Permitted","2 YEARS - 5 YEARS","24","DC37227","PRESCHOOL","GDC","Child Care - Pre School","3137008",,"2018-10-04T17:18:21.000","Y","16.6667","21.905","2","11.9769","0","6.1285","16.6667","18.9541","2021-11-16T00:00:00.000","Outdoor play area was observed Not maintained Nr free of hazards or nuisances at time of inspection.","CRITICAL","47.47(e)","CORRECTED","Initial Annual Inspection - Reinspection Required"
"DREAMLAND DAY CARE CENTER","DREAMLAND DAY CARE CENTER INC.","1379","WEST 7TH STREET","BROOKLYN","11204","718-232-8155","8228","2024-12-23T00:00:00.000","Permitted","2 YEARS - 5 YEARS","40","DC21458","PRESCHOOL","GDC","Child Care - Pre School","3392742",,"2010-12-23T00:00:00.000","Y","33.3333","21.905","7","11.9769","0","6.1285","33.3333","18.9541","2020-12-30T00:00:00.000","At time of inspection child care service facility observed Not maintained or in disrepair. Dry sweeping observed in areas occupied by children.","CRITICAL","47.49(a)","CORRECTED","Monitoring Inspection Non-Routine - Reinspection Required; Fines pending"
"FRANKLIN PLAZA EARLY CHILDHOOD CENTER","UNION SETTLEMENT ASSOCIATION, INC.","2081","SECOND AVENUE","MANHATTAN","10029","212-828-6052","7460","2023-09-26T00:00:00.000","Permitted","2 YEARS - 5 YEARS","60","DC14452","PRESCHOOL","GDC","Child Care - Pre School","1080693","www.unionsettlement.org","2005-09-26T00:00:00.000","N","20","21.905","7","11.9769","20","6.1285","20","18.9541","2023-04-03T00:00:00.000","Windows excluding fire escape windows in a child care service observed without window guards in a child care service.","PUBLIC HEALTH HAZARD","47.41(e)","CORRECTED","Initial Annual Inspection - Reinspection Not Required"
"Greater Flushing Community Council Inc","Greater Flushing Community Council Inc","47-49","162 STREET","QUEENS","11358","718-939-6060","104184","2023-07-28T00:00:00.000","Permitted","2 YEARS - 5 YEARS","35","DC35516","PRESCHOOL","GDC","Child Care - Pre School","4124143",,"2017-07-28T09:30:49.000","Y","16.6667","21.905","6","11.9769","0","6.1285","16.6667","18.9541","2023-01-31T00:00:00.000","There were no new violations observed at the time of this inspection/visit.",,,"N/A","Initial Annual Inspection - Passed inspection with no violations"
"THERAPY AND LEARNING CENTER, INC","THERAPY AND LEARNING CENTER, INC.","1723","8 AVENUE","BROOKLYN","11215","718-290-2700","7129","2024-02-04T00:00:00.000","Permitted","2 YEARS - 5 YEARS","168","DC1508","PRESCHOOL","GDC","Child Care - Pre School","3330250","www.tlckids.org","2004-03-09T00:00:00.000","N","16.6667","21.905","28","11.9769","0","6.1285","16.6667","18.9541","2023-01-06T00:00:00.000","At time of inspection floors/walls ceilings were observed Not maintained; in disrepair or covered in a toxic finish.","GENERAL","47.41(j)","CORRECTED","Initial Annual Inspection - Reinspection Not Required"
"NORTHEAST BRONX DAY CARE CENTER, INC.","NORTHEAST BRONX DAY CARE CENTER, INC.","1140","EAST 229TH STREET","BRONX","10466","718-547-1735","4142","2024-04-03T00:00:00.000","Permitted","2 YEARS - 5 YEARS","117","DC374","PRESCHOOL","GDC","Child Care - Pre School","2094178",,"2004-04-02T00:00:00.000","N","66.6667","21.905","11","11.9769","0","6.1285","66.6667","18.9541","2021-12-02T00:00:00.000","At time of inspection hand wash sinks are Not supplied with an adequate amount of running water. At time of inspection water temperature exceeded 115 deg Fahrenheit.","CRITICAL","47.43(e)","CORRECTED","Initial Annual Inspection - Reinspection Required; Fines pending"
"GRYC COMPASS/SONIC  P.S./IS 128 SUMMER CAMP","The Greater Ridgewood Youth Council Inc.","63-25","69 Street","QUEENS","11379","718-456-5437","104835","2020-09-15T00:00:00.000","Expired-In Renewal","0 YEARS - 16 YEARS","0","DC38261","ALL AGE CAMP","Camp","Camp","4070411",,"2019-05-28T16:09:23.000","Y",,,"0","1",,,,,,,,,,
"EIS LAASOIS CHILD DEVELOPMENT SERVICES","WILLIAMSBURG INFANT & EARLY CHILDHOOD DEVELOPMENT CENTER","6202","15TH AVE","BROOKLYN","11219","718-303-9400","105309","2023-03-31T00:00:00.000","Expired-In Renewal","2 YEARS - 5 YEARS","165","DC39853","PRESCHOOL","GDC","Child Care - Pre School","3141674",,"2021-03-31T10:04:04.000","Y","33.3333","21.905","32","11.9769","33.3333","6.1285","0","18.9541","2022-07-28T00:00:00.000","There were no new violations observed at the time of this inspection/visit.",,,"N/A",
"EIS LAASOIS CHILD DEVELOPMENT SERVICES","WILLIAMSBURG INFANT & EARLY CHILDHOOD DEVELOPMENT CENTER","6202","15TH AVE","BROOKLYN","11219","718-303-9400","105309","2023-03-31T00:00:00.000","Expired-In Renewal","2 YEARS - 5 YEARS","165","DC39853","PRESCHOOL","GDC","Child Care - Pre School","3141674",,"2021-03-31T10:04:04.000","Y","33.3333","21.905","32","11.9769","33.3333","6.1285","0","18.9541","2022-07-28T00:00:00.000","There were no new violations observed at the time of this inspection/visit.",,,"N/A",
"STEPPING STONE PRE & GRADE SCHOOL","STEPPING STONE OF SOUTH EASTERN QUEENS, INC.","114-36","FRANCIS LEWIS BOULEVARD","QUEENS","11411","718-465-2344",,"1900-01-01T00:00:00.000","Active","3 YEARS - 5 YEARS","0","DC40603","PRESCHOOL","SBCC","School Based Child Care","4236999","steppingstone1982.com",,,"50","45.1817","4","8.0094","0","23.3017","50","35.2291","2022-04-08T00:00:00.000","Teaching and supervisory staff trained in abuse/maltreatment identification and reporting. 2 hours of training received every 24 months. Training provided by OCFS approved trainer. New staff trained within 3 months of hire","GENERAL","43.14(a)","CORRECTED","Initial Annual Inspection - Reinspection Required; Fines pending"
"JEWISH INSTITUTE OF QUEENS PRESCHOOL","JEWISH INSTITUTE OF QUEENS PRESCHOOL","64-41","UTOPIA PKWY.","QUEENS","11365","718-480-0100",,"1900-01-01T00:00:00.000","Active","3 YEARS - 5 YEARS","0","DC32060","PRESCHOOL","SBCC","School Based Child Care","4152874",,,,"100","45.1817","19","8.0094","100","23.3017","100","35.2291","2022-04-08T00:00:00.000","Failure to install approved window guards or limiting devices in child accessible areas","PUBLIC HEALTH HAZARD","43.24(b)","CORRECTED",
"STEPS TO SUCCESS V","STEPS TO SUCCESS V LLC","360","NEPTUNE AVENUE","BROOKLYN","11235","718-513-4333","103940","2025-02-10T00:00:00.000","Permitted","2 YEARS - 5 YEARS","219","DC33827","PRESCHOOL","GDC","Child Care - Pre School","3000000","www.stepstosuccess.com","2017-02-10T11:52:57.000","Y","0","21.905","34","11.9769","0","6.1285","0","18.9541","2022-05-13T00:00:00.000","There were no new violations observed at the time of this inspection/visit.",,,"N/A","Initial Annual Inspection - Passed inspection with no violations"
"KIDS IN THE GAME LLC","Kids in the Game, LLC","4","East  90  Street","MANHATTAN","10128","212-641-0260","104882","2022-09-15T00:00:00.000","Expired-In Renewal","0 YEARS - 16 YEARS","100","DC38262","ALL AGE CAMP","Camp","Camp","1046979",,"2019-06-20T17:07:24.000","Y","0","26.8868","0","1","0","14.2558","0","21.8553","2021-08-16T00:00:00.000","Camp maintains staff application and qualification documents on file. Employee credentials verified","GENERAL","48.09(m)(1)","CORRECTED","Initial Annual Inspection - Reinspection Not Required"
"FIVE STAR DAY CARE CENTER","SOUTHEAST BRONX NEIGHBORHOOD CENTERS, INC.","3261","3 AVENUE","BRONX","10456","718-292-4774","4663","2023-05-18T00:00:00.000","Permitted","2 YEARS - 5 YEARS","100","DC1648","PRESCHOOL","GDC","Child Care - Pre School","2001228","www.sebnc.org","2005-02-15T00:00:00.000","N",,,"11","11.9769",,,,,"2021-04-23T00:00:00.000","Hot water sanitization maintains temperature of 170 degree F; thermometer provided","CRITICAL","81.29(a)(3)(A)","CORRECTED","Compliance Inspection of Open Violations - Reinspection Not Required"
"LITTLE PICKLES","ERL GROUP LLC","2169","CONEY ISLAND AVENUE","BROOKLYN","11223","718-676-1725","32577","2025-02-14T00:00:00.000","Permitted","0 YEARS - 2 YEARS","15","DC22109","INFANT TODDLER","GDC","Child Care - Infants/Toddlers","3183875",,"2013-02-14T00:00:00.000","Y","0","17.4391","3","8.4034","0","4.9984","0","15.3835","2021-04-21T00:00:00.000","There were no new violations observed at the time of this inspection/visit.",,,"N/A","Initial Annual Inspection - Passed inspection with no violations"
"EDEN II SCHOOL FOR AUTISTIC CHILDREN, INC.","EDEN II SCHOOL FOR AUTISTIC CHILDREN, INC.","309","ST PAUL'S AVENUE","STATEN ISLAND","10304","718-727-8202","104792","2023-04-12T00:00:00.000","Expired-In Renewal","2 YEARS - 5 YEARS","69","DC35312","PRESCHOOL","GDC","Child Care - Pre School","5013580","www.eden2.org","2019-04-12T11:06:59.000","Y","0","21.905","22","11.9769","0","6.1285","0","18.9541","2022-02-24T00:00:00.000","There were no new violations observed at the time of this inspection/visit.",,,"N/A",
"SEMILLITAS CORP.","SEMILLITAS CORP.","81-07","NORTHERN BOULEVARD","QUEENS","11372","718-507-2723","7033","2024-11-05T00:00:00.000","Permitted","2 YEARS - 5 YEARS","20","DC2801","PRESCHOOL","GDC","Child Care - Pre School","4026954",,"2002-02-25T00:00:00.000","Y","50","21.905","4","11.9769","33.3333","6.1285","50","18.9541","2022-10-28T00:00:00.000","At time of inspection floors/walls ceilings were observed Not maintained; in disrepair or covered in a toxic finish.","GENERAL","47.41(j)","CORRECTED",
"AMAZING KIDS LEARNING CENTER","AMAZING KIDS CORP","2331","Eastchester Road","BRONX","10469","718-654-5437","105134","2024-01-30T00:00:00.000","Permitted","2 YEARS - 5 YEARS","90","DC37363","PRESCHOOL","GDC","Child Care - Pre School","2050818",,"2020-01-30T11:10:28.000","Y","25","21.905","14","11.9769","0","6.1285","25","18.9541","2020-08-21T00:00:00.000","There were no new violations observed at the time of this inspection/visit.",,,"N/A",
"LAC EARLY CHILDHOOD CENTER","LIFE ADJUSTMENT CENTER, INC.","2","FIFTH AVENUE","MANHATTAN","10011","212-828-3975","104253","2023-10-11T00:00:00.000","Permitted",,"31","DC35249","PRESCHOOL","GDC","Child Care - Pre School","1008850","www.lifeadjustmentcenter.com","2017-10-11T19:06:43.000","Y","0","21.905","5","11.9769","0","6.1285","0","18.9541","2021-10-28T00:00:00.000","There were no new violations observed at the time of this inspection/visit.",,,"N/A","Monitoring Inspection Non-Routine - Passed inspection with no violations"
"TINY TUNES DAYCARE EVERGREEN","TINY TUNES DAYCARE EVERGREEN, INC.","1144","EVERGREEN AVENUE","BRONX","10472","646-302-6787","105434","2023-07-09T00:00:00.000","Permitted","2 YEARS - 5 YEARS","60","DC40112","PRESCHOOL","GDC","Child Care - Pre School","0",,"2021-07-09T13:03:30.000","Y","66.6667","21.905","11","11.9769","0","6.1285","66.6667","18.9541","2022-03-23T00:00:00.000","There were no new violations observed at the time of this inspection/visit.",,,"N/A","Initial Annual Inspection - Passed inspection; Violations corrected at time of inspection"
"HAPPY DRAGON OF NEW YORK, INC.","HAPPY DRAGON OF NEW YORK, INC.","5805","7TH AVENUE","BROOKLYN","11220","718-439-8816","8138","2024-03-22T00:00:00.000","Permitted","2 YEARS - 5 YEARS","135","DC20623","PRESCHOOL","GDC","Child Care - Pre School","3016180",,"2010-03-22T00:00:00.000","Y","0","21.905","17","11.9769","0","6.1285","0","18.9541","2020-07-23T00:00:00.000","There were no new violations observed at the time of this inspection/visit.",,,"N/A","Monitoring Inspection Non-Routine - Passed inspection with no violations"
"HAPPY DRAGON OF NEW YORK, INC.","HAPPY DRAGON OF NEW YORK, INC.","5805","7TH AVENUE","BROOKLYN","11220","718-439-8816","8138","2024-03-22T00:00:00.000","Permitted","2 YEARS - 5 YEARS","135","DC20623","PRESCHOOL","GDC","Child Care - Pre School","3016180",,"2010-03-22T00:00:00.000","Y","0","21.905","17","11.9769","0","6.1285","0","18.9541","2020-07-23T00:00:00.000","There were no new violations observed at the time of this inspection/visit.",,,"N/A","Monitoring Inspection Non-Routine - Passed inspection with no violations"
"THE GODDARD SCHOOL","2495  BROADWAY CENTER LLC","1775","York  Avenue","MANHATTAN","10128","212-860-8700","103931","2023-01-17T00:00:00.000","Expired-In Renewal","2 YEARS - 5 YEARS","52","DC34024","PRESCHOOL","GDC","Child Care - Pre School","1050763","www.godardschool.com","2017-01-17T18:51:31.000","Y","0","21.905","14","11.9769","0","6.1285","0","18.9541","2022-10-18T00:00:00.000","At time of inspection hallways and other means of egress were observed obstructed and impassable.","PUBLIC HEALTH HAZARD","47.41(f)","CORRECTED","Monitoring Inspection Non-Routine - Reinspection Not Required"
"CENTRAL PARK MONTESSORI, INC.","CENTRAL PARK MONTESSORI, INC.","1","WEST 91ST STREET","MANHATTAN","10024","212-595-2000","8251","2023-01-28T00:00:00.000","Expired-In Renewal",,"36","DC21253","INFANT TODDLER","GDC","Child Care - Infants/Toddlers","1031625","www.twinparks.org","2011-01-28T00:00:00.000","Y","0","17.4391","8","8.4034","0","4.9984","0","15.3835","2022-05-11T00:00:00.000","There were no new violations observed at the time of this inspection/visit.",,,"N/A","Initial Annual Inspection - Passed inspection with no violations"
"CREATIVE DISCOVERY PRE-SCHOOL","CREATIVE DISCOVERY PRE-SCHOOL INC","64-01","102 STREET","QUEENS","11374","917-502-0685","7293","2024-10-01T00:00:00.000","Permitted","2 YEARS - 5 YEARS","64","DC10993","PRESCHOOL","GDC","Child Care - Pre School","4051191","www.creativediscoverydaycare.com","2004-10-01T00:00:00.000","N","50","21.905","7","11.9769","16.6667","6.1285","50","18.9541","2023-01-25T00:00:00.000","At time of inspection it was determined that child care service allows staff to perform their duties that are Not healthy or are incapable of carrying out their duties. Staff medical clearances are Not maintained by child care service.","GENERAL","47.33(b)","OPEN","Initial Annual Inspection - Reinspection Required; Fines pending"
"CREATIVE DISCOVERY PRE-SCHOOL","CREATIVE DISCOVERY PRE-SCHOOL INC","64-01","102 STREET","QUEENS","11374","917-502-0685","7293","2024-10-01T00:00:00.000","Permitted","2 YEARS - 5 YEARS","64","DC10993","PRESCHOOL","GDC","Child Care - Pre School","4051191","www.creativediscoverydaycare.com","2004-10-01T00:00:00.000","N","50","21.905","7","11.9769","16.6667","6.1285","50","18.9541","2023-01-25T00:00:00.000","At time of inspection it was determined that child care service allows staff to perform their duties that are Not healthy or are incapable of carrying out their duties. Staff medical clearances are Not maintained by child care service.","GENERAL","47.33(b)","OPEN","Initial Annual Inspection - Reinspection Required; Fines pending"
"SHIRLEY CHISHOLM DAY CARE CENTER  #1","SHIRLEY CHISHOLM DAY CARE CENTER, INC.","2023","PACIFIC STREET","BROOKLYN","11233","718-756-1721","4196","2023-07-06T00:00:00.000","Permitted","0 YEARS - 2 YEARS","8","DC10762","INFANT TODDLER","GDC","Child Care - Infants/Toddlers","3038522",,"2005-07-06T00:00:00.000","N","0","17.4391","5","8.4034","0","4.9984","0","15.3835","2022-02-23T00:00:00.000","There were no new violations observed at the time of this inspection/visit.",,,"N/A","Initial Annual Inspection - Passed inspection with no violations"
"BNOS CHAYIL","BNOS CHAYIL","382","WILLOUGHBY AVENUE","BROOKLYN","11205","718-388-6201","105863","1900-01-01T00:00:00.000","Active","3 YEARS - 5 YEARS","0","DC41616","PRESCHOOL","SBCC","School Based Child Care","3393747","N/A",,,"100","45.1817","7","8.0094","100","23.3017","100","35.2291","2022-08-16T00:00:00.000","Water Not tested for lead as required. Elevated lead levels Not remediated. School fails to use approved water source when indicated","CRITICAL","43.24(a)","CORRECTED","Initial Annual Inspection - Reinspection Required"
"BRIGHT HORIZONS CHILDREN'S CENTERS","BRIGHT HORIZONS CHILDREN'S CENTERS, INC.","100","WEST 89TH STREET","MANHATTAN","10024","646-930-0380","74818","2024-10-31T00:00:00.000","Permitted","0 YEARS - 2 YEARS","27","DC32487","INFANT TODDLER","GDC","Child Care - Infants/Toddlers","1032320","WWW.BRIGHTHORIZONS.COM/WEST89T","2014-10-31T00:00:00.000","Y","0","17.4391","7","8.4034","0","4.9984","0","15.3835","2021-10-14T00:00:00.000","At time of inspection hallways and other means of egress were observed obstructed and impassable.","PUBLIC HEALTH HAZARD","47.41(f)","CORRECTED","Monitoring Inspection Non-Routine - Reinspection Required; Fines pending"
"WILLIAMSBURG MONTESSORI","WILLIAMSBURG MONTESSORI SCHOOL","450","KENT AVENUE","BROOKLYN","11249","718-384-3400","105488","1900-01-01T00:00:00.000","Active","3 YEARS - 5 YEARS","65","DC40615","PRESCHOOL","SBCC","School Based Child Care","3387990",,,,"100","45.1817","1","8.0094","100","23.3017","100","35.2291","2022-02-09T00:00:00.000","Children enrolled in school-based child care program have Not received periodic medical examination.","CRITICAL","43.17(c)","CORRECTED","Initial Annual Inspection - Reinspection Required; Fines pending"
"STRAWBERRY PATCH DAY CARE  INC.","STRAWBERRY PATCH DAY CARE CENTER, INC.","2007","LINDEN BOULEVARD","BROOKLYN","11207","718-257-7555","7429","2023-05-30T00:00:00.000","Permitted","0 YEARS - 2 YEARS","18","DC12233","INFANT TODDLER","GDC","Child Care - Infants/Toddlers","3097353",,"2005-05-30T00:00:00.000","Y",,,"3","8.4034",,,,,"2022-12-07T00:00:00.000","At time of inspection it was determined that child care service allows staff to perform their duties that are Not healthy or are incapable of carrying out their duties. Staff medical clearances are Not maintained by child care service.","GENERAL","47.33(b)","CORRECTED",
"HIGHBRIDGE ADVISORY COUNCIL ECC # 3","HIGHBRIDGE ADVISORY COUNCIL FAMILY SERVICES INC.","1399","OGDEN AVENUE","BRONX","10452","718-293-9196","6683","2023-12-02T00:00:00.000","Permitted","2 YEARS - 5 YEARS","132","DC844","PRESCHOOL","GDC","Child Care - Pre School","2116205",,"2003-10-30T00:00:00.000","N",,,"25","11.9769",,,,,"2021-12-22T00:00:00.000","SCR clearances Not arranged for; clearance review Not conducted; SCR clearance Not repeated every two years","CRITICAL","47.19(c)(3)","CORRECTED",
"GUIDEPOST MONTESSORI AT COLUMBUS SQUARE","HGE FIC F LLC","775","COLUMBUS AVENUE","MANHATTAN","10025","551-333-1337","104727","2023-02-05T00:00:00.000","Expired-In Renewal","2 YEARS - 5 YEARS","135","DC37573","PRESCHOOL","GDC","Child Care - Pre School","1088481","https://polis.school","2019-02-05T11:54:02.000","Y","50","21.905","13","11.9769","25","6.1285","50","18.9541","2023-01-23T00:00:00.000","There were no new violations observed at the time of this inspection/visit.",,,"N/A","Monitoring Inspection Non-Routine - Previously closed program re-opened"
"SUNSHINE NURSERY AND DAY CARE CENTER","CNNA INC.","576","GATES AVENUE","BROOKLYN","11221","718-452-9740","7333","2023-01-08T00:00:00.000","Expired-In Renewal","2 YEARS - 5 YEARS","65","DC14585","PRESCHOOL","GDC","Child Care - Pre School","3051225","www.sunshinedaycarenyc.com","2004-12-22T00:00:00.000","Y",,,"19","11.9769",,,,,"2023-01-25T00:00:00.000","Education Director or equivalent was Not present at the time of inspection to supervise children/staff in an infant/toddler program.","CRITICAL","47.23(c)","CORRECTED",
"MANHATTAN SCHOOLHOUSE LLC","MANHATTAN SCHOOLHOUSE LLC","1624","FIRST AVENUE","MANHATTAN","10028","212-772-2066","85697","2025-04-17T00:00:00.000","Permitted","0 YEARS - 2 YEARS","56","DC26004","INFANT TODDLER","GDC","Child Care - Infants/Toddlers","1050520","www.manhattanschoolhouse.com","2015-04-17T00:00:00.000","Y","20","17.4391","19","8.4034","20","4.9984","0","15.3835","2022-02-15T00:00:00.000","There were no new violations observed at the time of this inspection/visit.",,,"N/A","Initial Annual Inspection - Passed inspection with no violations"
"DREAMLAND DAY CARE CENTER","DREAMLAND DAY CARE CENTER INC.","1379","WEST 7TH STREET","BROOKLYN","11204","718-232-8155","8228","2024-12-23T00:00:00.000","Permitted","2 YEARS - 5 YEARS","40","DC21458","PRESCHOOL","GDC","Child Care - Pre School","3392742",,"2010-12-23T00:00:00.000","Y","33.3333","21.905","7","11.9769","0","6.1285","33.3333","18.9541","2023-04-12T00:00:00.000","Fire extinguishers observed Not to be inspected or maintained at time of inspection.","CRITICAL","47.59(b)","OPEN","Initial Annual Inspection - Reinspection Required"
"ROOSEVELT ISLAND DAY NURSERY","ROOSEVELT ISLAND DAY NURSERY","405","MAIN STREET","MANHATTAN","10044","212-935-3747","8325","2022-09-24T00:00:00.000","Expired-In Renewal","2 YEARS - 5 YEARS","15","DC19143","PRESCHOOL","GDC","Child Care - Pre School","1087314","www.ridn.org","2010-09-24T00:00:00.000","Y","0","21.905","8","11.9769","0","6.1285","0","18.9541","2021-04-21T00:00:00.000","There were no new violations observed at the time of this inspection/visit.",,,"N/A","Initial Annual Inspection - Passed inspection with no violations"
"CHRIST CHURCH, METHODIST EPISCOPAL, OF NEW YORK CITY","CHRIST CHURCH, METHODIST EPISCOPAL, OF NEW YORK CITY","520-524","PARK AVENUE","MANHATTAN","10022","212-838-3039","1789","2024-02-19T00:00:00.000","Permitted","2 YEARS - 5 YEARS","75","DC2417","PRESCHOOL","GDC","Child Care - Pre School","1090526","www.christchurchnyc.org","2003-09-04T00:00:00.000","N","50","21.905","14","11.9769","25","6.1285","25","18.9541","2022-01-19T00:00:00.000","Constant and competent supervision provided by adequate staff for children and groups of children","PUBLIC HEALTH HAZARD","47.23(a)","CORRECTED","Initial Annual Inspection - Reinspection Required; Fines pending"
"THE EAST CHELSEA CHILDRENS WORKSHOP, INC.","THE EAST CHELSEA CHILDRENS WORKSHOP, INC.","17","EAST 16TH STREET","MANHATTAN","10003","212-691-8964","4869","2023-07-15T00:00:00.000","Permitted","2 YEARS - 5 YEARS","29","DC2419","PRESCHOOL","GDC","Child Care - Pre School","1016084","WWW.CHILDRENSINTERNATIONALWORKSHOP.COM","2003-03-02T00:00:00.000","N","50","21.905","6","11.9769","0","6.1285","50","18.9541","2021-04-21T00:00:00.000","All teachers have Not received training in infectious disease control and reporting.","CRITICAL","47.37(b)(2)","CORRECTED","Initial Annual Inspection - Passed inspection; Violations corrected at time of inspection"
"CRECHE LES ETOILES LLC","CRECHE LES ETOILES LLC","44-11","30 AVENUE","QUEENS","11103","646-868-8800","105322","2025-04-29T00:00:00.000","Permitted","2 YEARS - 5 YEARS","15","DC38800","PRESCHOOL","GDC","Child Care - Pre School","4012140",,"2021-04-29T15:19:18.000","Y","40","21.905","6","11.9769","20","6.1285","40","18.9541","2021-07-28T00:00:00.000","There were no new violations observed at the time of this inspection/visit.",,,"N/A","Initial Annual Inspection - Passed inspection with no violations"
"RISING GROUND INC.","RISING GROUND, INC.","1751","PARK AVENUE","MANHATTAN","10035","347-758-9128","96417","2023-09-04T00:00:00.000","Permitted","2 YEARS - 5 YEARS","89","DC26145","PRESCHOOL","GDC","Child Care - Pre School","1089077","www.leakeandwatts.org","2015-09-04T00:00:00.000","Y","20","21.905","13","11.9769","0","6.1285","20","18.9541","2023-03-07T00:00:00.000","Department is Notified in 24 hours of the death or serious injury of a child in childcare by permittee","PUBLIC HEALTH HAZARD","47.27(c)(2)","CORRECTED","Monitoring Inspection Non-Routine - Reinspection Required"
"JEWISH INSTITUTE OF QUEENS PRESCHOOL","JEWISH INSTITUTE OF QUEENS PRESCHOOL","64-41","UTOPIA PKWY.","QUEENS","11365","718-480-0100",,"1900-01-01T00:00:00.000","Active","3 YEARS - 5 YEARS","0","DC32060","PRESCHOOL","SBCC","School Based Child Care","4152874",,,,"100","45.1817","19","8.0094","100","23.3017","100","35.2291","2022-11-03T00:00:00.000","Teaching and supervisory staff trained in infection control, reporting of infectious diseases, administration of medication, handling/storage of hazardous materials, general safety, and transportation. New staff trained within 3 months of hire","GENERAL","43.14(b)","CORRECTED","Initial Annual Inspection - Reinspection Required; Fines pending"
