"centername","legalname","building","street","borough","zipcode","phone","permitnumber","permitexp","status","agerange","maximumcapacity","dc_id","programtype","facilitytype","childcaretype","bin","url","datepermitted","actual","violationratepercent","violationavgratepercent","totaleducationalworkers","averagetotaleducationalworkers","publichealthhazardviolationrate","averagepublichealthhazardiolationrate","criticalviolationrate","avgcriticalviolationrate","inspectiondate","regulationsummary","violationcategory","healthcodesubsection","violationstatus","inspectionsummaryresult"
"THE GREEK ORTHODOX COMMUNITY OF WHITESTONE, HOLY CROSS, INC.","THE GREEK ORTHODOX COMMUNITY OF WHITESTONE, HOLY CROSS, INC.","12-03","150 Street","QUEENS","11357","718-747-3803","105763","2024-08-05T00:00:00.000","Permitted","2 YEARS - 5 YEARS","34","DC38425","PRESCHOOL","GDC","Child Care - Pre School","4308660",,"2022-08-05T17:28:32.000","Y","0","21.905","4","11.9769","0","6.1285","0","18.9541","2022-11-09T00:00:00.000","Staff and volunteers obtain documentation showing immunization with 2 doses measles/mumps, 1 dose rubella, 2 doses varicella and 1 dose Tdap. Medical exemptions only. History of measles, mumps or rubella shall Not replace MMR vaccine except in presence of MMR varicella antibodies.","GENERAL","47.33(c)(1)","CORRECTED","Initial Annual Inspection - Reinspection Not Required"
"CITIZENS CARE DAY CARE CENTER, INC.","CITIZENS CARE DAY CARE CENTER I","131","ST NICHOLAS AVENUE","MANHATTAN","10026","212-666-1683","2055","2024-03-05T00:00:00.000","Permitted","2 YEARS - 5 YEARS","40","DC2156","PRESCHOOL","GDC","Child Care - Pre School","1058378",,"2004-02-02T00:00:00.000","N","20","21.905","4","11.9769","20","6.1285","20","18.9541","2021-11-10T00:00:00.000","There were no new violations observed at the time of this inspection/visit.",,,"N/A","Compliance Inspection of Open Violations - Previously cited violations corrected"
"OLD FIRST NURSERY SCHOOL","OLD FIRST NURSERY SCHOOL","729","CARROLL STREET","BROOKLYN","11215","347-460-6367","1648","2022-10-11T00:00:00.000","Expired-In Renewal","2 YEARS - 5 YEARS","16","DC462","PRESCHOOL","GDC","Child Care - Pre School","3020373","www.oldfirstnurseryschool.org","1971-05-18T00:00:00.000","Y","0","21.905","2","11.9769","0","6.1285","0","18.9541","2022-10-13T00:00:00.000","There were no new violations observed at the time of this inspection/visit.",,,"N/A","Monitoring Inspection Non-Routine - Passed inspection with no violations"
"YOUNGERMUSIK","YOUNGERMUSIK CORP.","1529","BATH AVENUE","BROOKLYN","11228","347-234-3813","52997","2023-10-11T00:00:00.000","Permitted","2 YEARS - 5 YEARS","24","DC25830","PRESCHOOL","GDC","Child Care - Pre School","3167391","www.youngermusik.com","2013-10-11T00:00:00.000","Y","0","21.905","9","11.9769","0","6.1285","0","18.9541","2023-03-09T00:00:00.000","There were no new violations observed at the time of this inspection/visit.",,,"N/A","Initial Annual Inspection - Passed inspection with no violations"
"THE EDUCATIONAL ALLIANCE, INC.","THE EDUCATIONAL ALLIANCE, INC.","197","EAST BROADWAY","MANHATTAN","10002","646-395-4233","6531","2024-10-06T00:00:00.000","Permitted","0 YEARS - 2 YEARS","66","DC12262","INFANT TODDLER","GDC","Child Care - Infants/Toddlers","1003704","www.edalliance.org","2006-10-06T00:00:00.000","N","0","17.4391","20","8.4034","0","4.9984","0","15.3835","2020-11-06T00:00:00.000","There were no new violations observed at the time of this inspection/visit.",,,"N/A","Initial Annual Inspection - Passed inspection with no violations"
"FORT GEORGE COMMUNITY SERVICES, INC","FORT GEORGE COMMUNITY SERVICES, INC.","489","ST. PAULS PLACE","BRONX","10456","917-801-0565","71597","2024-08-07T00:00:00.000","Permitted","2 YEARS - 5 YEARS","40","DC32212","PRESCHOOL","GDC","Child Care - Pre School","2009542","www.fortgeorgecenter.org","2014-08-07T00:00:00.000","Y","100","21.905","5","11.9769","0","6.1285","100","18.9541","2022-10-25T00:00:00.000","At time of inspection it was determined that child care service allows staff to perform their duties that are Not healthy or are incapable of carrying out their duties. Staff medical clearances are Not maintained by child care service.","GENERAL","47.33(b)","CORRECTED","Initial Annual Inspection - Reinspection Required; Fines pending"
"EDEN II SCHOOL FOR AUTISTIC CHILDREN, INC.","EDEN II SCHOOL FOR AUTISTIC CHILDREN, INC.","309","ST PAUL'S AVENUE","STATEN ISLAND","10304","718-727-8202","104792","2023-04-12T00:00:00.000","Expired-In Renewal","2 YEARS - 5 YEARS","69","DC35312","PRESCHOOL","GDC","Child Care - Pre School","5013580","www.eden2.org","2019-04-12T11:06:59.000","Y","0","21.905","22","11.9769","0","6.1285","0","18.9541","2022-12-01T00:00:00.000","At time of inspection floors/walls ceilings were observed Not maintained; in disrepair or covered in a toxic finish.","GENERAL","47.41(j)","OPEN","Monitoring Inspection Non-Routine - Reinspection Not Required"
"BRIGHT BEGINNINGS","BRITE ADVENTURE CENTER, INC.","86-25","162 STREET","QUEENS","11432","718-297-6767","5099","2023-11-16T00:00:00.000","Permitted","2 YEARS - 5 YEARS","94","DC10990","PRESCHOOL","GDC","Child Care - Pre School","4209097",,"1986-02-23T00:00:00.000","Y","33.3333","21.905","16","11.9769","0","6.1285","33.3333","18.9541","2021-08-20T00:00:00.000","There were no new violations observed at the time of this inspection/visit.",,,"N/A","Initial Annual Inspection - Passed inspection with no violations"
"GKO GROUP, INC.","GKO GROUP, INC.","4020","EAST TREMONT AVENUE","BRONX","10465","718-239-5275","7528","2023-08-28T00:00:00.000","Permitted","0 YEARS - 2 YEARS","28","DC1588","INFANT TODDLER","GDC","Child Care - Infants/Toddlers","2000000","ivyprep.org","2005-06-03T00:00:00.000","Y","25","17.4391","11","8.4034","0","4.9984","25","15.3835","2021-07-29T00:00:00.000","There were no new violations observed at the time of this inspection/visit.",,,"N/A",
"ALWAYZ 1.2.3. EARLY LEARNING CENTER, INC.","ALWAYZ 1.2.3. EARLY LEARNING CENTER, INC.","80","BAY STREET","STATEN ISLAND","10301","718-815-4701","49177","2023-07-26T00:00:00.000","Permitted","0 YEARS - 2 YEARS","14","DC22981","INFANT TODDLER","GDC","Child Care - Infants/Toddlers","5000038",,"2013-07-26T00:00:00.000","Y","0","17.4391","7","8.4034","0","4.9984","0","15.3835","2021-04-09T00:00:00.000","There were no new violations observed at the time of this inspection/visit.",,,"N/A","Initial Annual Inspection - Passed inspection with no violations"
"NEW YORK KIDS CLUB","New York Kids Club","4545","CENTER BLVD","QUEENS","11109","917-363-8153","103697","2022-09-15T00:00:00.000","Expired-In Renewal","0 YEARS - 16 YEARS","0","DC34402","ALL AGE CAMP","Camp","Camp","4541713","www.nykidsclub.com","2016-07-13T10:37:47.000","Y","33.3333","26.8868","0","1","0","14.2558","33.3333","21.8553","2022-07-25T00:00:00.000","There were no new violations observed at the time of this inspection/visit.",,,"N/A","Initial Annual Inspection - Passed inspection with no violations"
"THE ECOLE","ECOLE INTERNATIONALE DE NEW YORK LLC","206","5TH AVE","MANHATTAN","10010","646-586-5105","105308","2025-03-29T00:00:00.000","Permitted","0 YEARS - 2 YEARS","12","DC39024","INFANT TODDLER","GDC","Child Care - Infants/Toddlers","1015621","THEECOLE.ORG","2021-03-29T10:36:03.000","Y","0","17.4391","2","8.4034","0","4.9984","0","15.3835","2022-03-04T00:00:00.000","There were no new violations observed at the time of this inspection/visit.",,,"N/A","Initial Annual Inspection - Passed inspection with no violations"
"EINSTEIN DAYCARE INC.","EINSTEIN DAYCARE","900","LENOX ROAD","BROOKLYN","11203","718-618-7330","100706","2024-02-25T00:00:00.000","Permitted","0 YEARS - 2 YEARS","37","DC33860","INFANT TODDLER","GDC","Child Care - Infants/Toddlers","3392635",,"2016-02-25T16:23:38.000","Y","0","17.4391","7","8.4034","0","4.9984","0","15.3835","2021-07-01T00:00:00.000","There were no new violations observed at the time of this inspection/visit.",,,"N/A","Initial Annual Inspection - Passed inspection with no violations"
"The Gloria Alston Children's Learning Center (WNYCS)","THE GLORIA ALSTON CHILDREN'S LEARNING CENTER (WNYCS)","1332","FULTON AVENUE","BRONX","10456","718-635-0474",,"1900-01-01T00:00:00.000","Active","3 YEARS - 5 YEARS","0","DC39831","PRESCHOOL","SBCC","School Based Child Care","2009685","info@wildflowernewyorkcharterrschool.org",,,"100","45.1817","2","8.0094","50","23.3017","100","35.2291","2022-10-12T00:00:00.000","School obtains written consent of employee to conduct clearance review and share results with Department","GENERAL","43.13(d)","CORRECTED","Initial Annual Inspection - Reinspection Required; Fines pending"
"RENA DAY CARE CENTERS, INC.","RENA DAY CARE CENTERS, INC.","639","EDGECOMBE AVENUE","MANHATTAN","10032","212-795-3700","4322","2022-03-15T00:00:00.000","Expired-In Renewal","2 YEARS - 5 YEARS","184","DC3034","PRESCHOOL","GDC","Child Care - Pre School","1062652",,"2003-10-29T00:00:00.000","N","0","21.905","8","11.9769","0","6.1285","0","18.9541","2022-11-29T00:00:00.000","Child care service failed to Notify DOHMH within 24 hours of child abuse allegation/indication or record of criminal activity of individuals associated with child care service; serious injury, death or loss of a child.","CRITICAL","47.19(g)","CORRECTED","Monitoring Inspection Non-Routine - Reinspection Required; Fines pending"
"APPLETREE DAY CARE CENTER INC","APPLETREE DAY CARE CENTER INC","73-20","BELL BLVD.","QUEENS","11364","718-264-1588","8241","2025-02-28T00:00:00.000","Permitted","2 YEARS - 5 YEARS","69","DC19803","PRESCHOOL","GDC","Child Care - Pre School","4439704",,"2011-02-28T00:00:00.000","Y","16.6667","21.905","12","11.9769","0","6.1285","16.6667","18.9541","2023-02-08T00:00:00.000","There were no new violations observed at the time of this inspection/visit.",,,"N/A","Compliance Inspection of Open Violations - Reinspection Required; Violations corrected at time of inspection"
"YEARLING NURSERY SCHOOL, INC.","YEARLING NURSERY SCHOOL, INC.","604","WEST 227TH STREET","BRONX","10463","718-549-1606","7507","2025-01-29T00:00:00.000","Permitted","2 YEARS - 5 YEARS","35","DC218","PRESCHOOL","GDC","Child Care - Pre School","2083272","yearlingnurseryschool.com","2004-12-14T00:00:00.000","Y","75","21.905","9","11.9769","0","6.1285","75","18.9541","2021-12-14T00:00:00.000","There were no new violations observed at the time of this inspection/visit.",,,"N/A","Compliance Inspection of Open Violations - Passed inspection; Violations corrected at time of inspection"
"BILINGUAL NEST, LLC","BILINGUAL NEST, LLC","300","MANHATTAN AVE","MANHATTAN","10026","917-825-8763","104232","2023-09-14T00:00:00.000","Permitted","2 YEARS - 5 YEARS","22","DC35464","PRESCHOOL","GDC","Child Care - Pre School","1055804","www.bilingualnestny.com","2017-09-14T19:07:39.000","Y","16.6667","21.905","7","11.9769","0","6.1285","16.6667","18.9541","2022-12-14T00:00:00.000","Plumbing and plumbing fixtures Not properly connected, vented, drained; Not installed and maintained in commercial building","GENERAL","131.09(c)","CORRECTED","Monitoring Inspection Non-Routine - Reinspection Not Required"
"LUTHERAN SOCIAL SERVICES OF METROPOLITAN NEW YORK","LUTHERAN SOCIAL SERVICES OF METROPOLITAN NEW YORK","888","WESTCHESTER AVENUE","BRONX","10459","718-450-3556","26118","2024-10-24T00:00:00.000","Permitted","2 YEARS - 5 YEARS","145","DC24608","PRESCHOOL","GDC","Child Care - Pre School","2005346","lssny.org/main","2012-10-24T00:00:00.000","Y",,,"8","11.9769",,,,,"2021-08-17T00:00:00.000","Individual certified in food protection Not on site during periods of food preparation.","CRITICAL","81.15(a)","CORRECTED",
"RIVERDALE TEMPLE","RIVERDALE TEMPLE","4545","INDEPENDENCE AVENUE","BRONX","10471","718-796-0335","1929","2023-01-16T00:00:00.000","Expired-In Renewal","2 YEARS - 5 YEARS","120","DC248","PRESCHOOL","GDC","Child Care - Pre School","2088698","www.riverdaletemplens.org","2005-01-08T00:00:00.000","N","66.6667","21.905","25","11.9769","66.6667","6.1285","66.6667","18.9541","2022-08-11T00:00:00.000","At time of inspection it was observed that child care service failed to provide appropriate guards on designated structures/equipment to protect children from potential injury.","GENERAL","47.41(h)","CORRECTED",
"JEWISH CONTINUITY ASSOCIATION, INC.","JEWISH CONTINUITY ASSOCIATION, INC.","4315","16TH AVE","BROOKLYN","11204","718-530-4130","104672","2024-12-14T00:00:00.000","Permitted","2 YEARS - 5 YEARS","102","DC36764","PRESCHOOL","GDC","Child Care - Pre School","3421702",,"2018-12-14T13:44:25.000","Y","0","21.905","6","11.9769","0","6.1285","0","18.9541","2021-03-03T00:00:00.000","Staff and volunteers obtain documentation showing immunization with 2 doses measles/mumps, 1 dose rubella, 2 doses varicella and 1 dose Tdap. Medical exemptions only. History of measles, mumps or rubella shall Not replace MMR vaccine except in presence of MMR varicella antibodies.","GENERAL","47.33(c)(1)","CORRECTED","Initial Annual Inspection - Passed inspection; Violations corrected at time of inspection"
"ST. JOHN'S ENGLISH EVANGELICAL LUTHERAN CHURCH OF RICHMOND HILL","ST. JOHN'S ENGLISH EVANGELICAL LUTHERAN CHURCH OF RICHMOND HILL","86-20","114 STREET","QUEENS","11418","718-441-3611","6480","2024-02-26T00:00:00.000","Permitted","2 YEARS - 5 YEARS","29","DC2824","PRESCHOOL","GDC","Child Care - Pre School","4192690",,"2004-02-26T00:00:00.000","N","20","21.905","5","11.9769","0","6.1285","20","18.9541","2023-01-12T00:00:00.000","At time of inspection it was determined that child care service failed to ensure staff received required training within time frames and/or failed to maintain training records.","CRITICAL","47.37(b)(1)","CORRECTED","Initial Annual Inspection - Reinspection Required; Fines pending"
"ST. JOHN'S ENGLISH EVANGELICAL LUTHERAN CHURCH OF RICHMOND HILL","ST. JOHN'S ENGLISH EVANGELICAL LUTHERAN CHURCH OF RICHMOND HILL","86-20","114 STREET","QUEENS","11418","718-441-3611","6480","2024-02-26T00:00:00.000","Permitted","2 YEARS - 5 YEARS","29","DC2824","PRESCHOOL","GDC","Child Care - Pre School","4192690",,"2004-02-26T00:00:00.000","N","20","21.905","5","11.9769","0","6.1285","20","18.9541","2023-01-12T00:00:00.000","At time of inspection it was determined that child care service failed to ensure staff received required training within time frames and/or failed to maintain training records.","CRITICAL","47.37(b)(1)","CORRECTED","Initial Annual Inspection - Reinspection Required; Fines pending"
"ST. CLARE OF ASSISI SCHOOL","ST. CLARE OF ASSISI SCHOOL","1911","HONE AVENUE","BRONX","10461","718-892-4080",,"2116-01-17T00:00:00.000","Active","3 YEARS - 5 YEARS","0","DC19537","PRESCHOOL","SBCC","School Based Child Care","2087156","www.archny.org/education",,,"50","45.1817","19","8.0094","50","23.3017","50","35.2291","2023-01-19T00:00:00.000","Heating apparatus provided with protective guards. Space heater prohibited","PUBLIC HEALTH HAZARD","43.22(d)","CORRECTED","Initial Annual Inspection - Reinspection Required; Fines pending"
"YOUNG RISERS INFANT-TODDLER PROGRAM","YOUNG RISES LLC","402","56TH STREET","BROOKLYN","11220","718-439-4817","103863","2024-11-22T00:00:00.000","Permitted","2 YEARS - 5 YEARS","17","DC23053","PRESCHOOL","GDC","Child Care - Pre School","3015314","www.youngrisers.com","2016-11-22T13:50:22.000","Y","0","21.905","2","11.9769","0","6.1285","0","18.9541","2023-04-12T00:00:00.000","There were no new violations observed at the time of this inspection/visit.",,,"N/A","Initial Annual Inspection - Passed inspection with no violations"
"YOUNG RISERS INFANT-TODDLER PROGRAM","YOUNG RISES LLC","5601","4TH AVENUE","BROOKLYN","11220","718-439-4817","103974","2023-03-21T00:00:00.000","Expired-In Renewal","0 YEARS - 2 YEARS","10","DC23069","INFANT TODDLER","GDC","Child Care - Infants/Toddlers","3015314",,"2017-03-21T10:54:26.000","Y","20","17.4391","4","8.4034","0","4.9984","20","15.3835","2021-03-17T00:00:00.000","All teachers have Not received training in infectious disease control and reporting.","CRITICAL","47.37(b)(2)","CORRECTED","Initial Annual Inspection - Reinspection Required"
"WAKE EDEN COMMUNITY BAPTIST CHURCH","WAKE EDEN COMMUNITY BAPTIST CHURCH","2074","STRANG AVENUE","BRONX","10466","718-325-8056","5234","2024-12-29T00:00:00.000","Permitted","2 YEARS - 5 YEARS","74","DC1825","PRESCHOOL","GDC","Child Care - Pre School","2066715",,"2004-12-15T00:00:00.000","N","0","21.905","10","11.9769","0","6.1285","0","18.9541","2022-10-26T00:00:00.000","All staff with potential for unsupervised contact with children including volunteers have Not been cleared","GENERAL","47.19(a)","CORRECTED",
"FRIENDS OF CROWN HEIGHTS EDUCATIONAL CENTERS, INC.","FRIENDS OF CROWN HEIGHTS EDUCATIONAL CENTERS, INC.","963","PARK PLACE","BROOKLYN","11213","718-778-8558","72865","2024-09-03T00:00:00.000","Permitted","2 YEARS - 5 YEARS","96","DC32238","PRESCHOOL","GDC","Child Care - Pre School","3031302","fochdaycare.org","2014-09-03T00:00:00.000","Y","28.5714","21.905","19","11.9769","28.5714","6.1285","0","18.9541","2021-06-11T00:00:00.000","There were no new violations observed at the time of this inspection/visit.",,,"N/A","Initial Annual Inspection - Passed inspection with no violations"
"BROOKLYN ARCHDIOCESE","IMMACULATE CONCEPTION PRESCHOOL","179-14","DALNY ROAD","QUEENS","11432","718-739-5933",,"2115-01-23T00:00:00.000","Active","3 YEARS - 5 YEARS","19","DC2512","PRESCHOOL","SBCC","School Based Child Care","4448808",,,,"50","45.1817","8","8.0094","50","23.3017","50","35.2291","2021-11-17T00:00:00.000","Teaching and supervisory staff trained in abuse/maltreatment identification and reporting. 2 hours of training received every 24 months. Training provided by OCFS approved trainer. New staff trained within 3 months of hire","GENERAL","43.14(a)","CORRECTED","Initial Annual Inspection - Reinspection Required; Fines pending"
"BROOKLYN ARCHDIOCESE","IMMACULATE CONCEPTION PRESCHOOL","179-14","DALNY ROAD","QUEENS","11432","718-739-5933",,"2115-01-23T00:00:00.000","Active","3 YEARS - 5 YEARS","19","DC2512","PRESCHOOL","SBCC","School Based Child Care","4448808",,,,"50","45.1817","8","8.0094","50","23.3017","50","35.2291","2021-11-17T00:00:00.000","Teaching and supervisory staff trained in abuse/maltreatment identification and reporting. 2 hours of training received every 24 months. Training provided by OCFS approved trainer. New staff trained within 3 months of hire","GENERAL","43.14(a)","CORRECTED","Initial Annual Inspection - Reinspection Required; Fines pending"
"BROOKLYN ARCHDIOCESE","IMMACULATE CONCEPTION PRESCHOOL","179-14","DALNY ROAD","QUEENS","11432","718-739-5933",,"2115-01-23T00:00:00.000","Active","3 YEARS - 5 YEARS","19","DC2512","PRESCHOOL","SBCC","School Based Child Care","4448808",,,,"50","45.1817","8","8.0094","50","23.3017","50","35.2291","2021-11-17T00:00:00.000","Teaching and supervisory staff trained in abuse/maltreatment identification and reporting. 2 hours of training received every 24 months. Training provided by OCFS approved trainer. New staff trained within 3 months of hire","GENERAL","43.14(a)","CORRECTED","Initial Annual Inspection - Reinspection Required; Fines pending"
"LAURELTON DAY CARE, INC.","LAURELTON DAY CARE, INC.","141-19","224 STREET","QUEENS","11413","718-712-1860","6625","2023-04-06T00:00:00.000","Expired-In Renewal",,"15","DC12281","INFANT TODDLER","GDC","Child Care - Infants/Toddlers","4282460",,"2005-03-31T00:00:00.000","N","0","17.4391","7","8.4034","0","4.9984","0","15.3835","2023-03-02T00:00:00.000","At time of inspection it was determined that child care service allows staff to perform their duties that are Not healthy or are incapable of carrying out their duties. Staff medical clearances are Not maintained by child care service.","GENERAL","47.33(b)","CORRECTED","Initial Annual Inspection - Reinspection Not Required"
"AMALGAMATED NURSERY SCHOOL","AMALGAMATED NURSERY SCHOOL","3980","ORLOFF AVENUE","BRONX","10463","718-543-8688","7169","2023-11-09T00:00:00.000","Permitted","2 YEARS - 5 YEARS","56","DC109","PRESCHOOL","GDC","Child Care - Pre School","2015481","amalgamatednurseryschool.com","1989-03-23T00:00:00.000","Y","100","21.905","11","11.9769","50","6.1285","75","18.9541","2021-09-23T00:00:00.000","Training in SIDS, Shaken Baby Syndrome and Safe Sleep practices Not provided to staff","CRITICAL","47.37(b)(4)","CORRECTED","Initial Annual Inspection - Reinspection Required; Fines pending"
"SUNSHINE DEVELOPMENTAL SCHOOL","SUNSHINE DEVELOPMENTAL  SCHOOL","91-10","146 STREET","QUEENS","11435","718-468-9000","7441","2023-09-08T00:00:00.000","Permitted","2 YEARS - 5 YEARS","216","DC14371","PRESCHOOL","GDC","Child Care - Pre School","4213884","sunshinedevelopmental.org","2005-09-06T00:00:00.000","Y","33.3333","21.905","144","11.9769","33.3333","6.1285","33.3333","18.9541","2021-01-29T00:00:00.000","There were no new violations observed at the time of this inspection/visit.",,,"N/A","Monitoring Inspection Non-Routine - Passed inspection with no violations"
"PLATINUM DAYCARE, INC.","PLATINUM DAYCARE, INC.","459","3rd Avenue","BROOKLYN","11215","917-909-1439","105005","2023-08-19T00:00:00.000","Permitted","0 YEARS - 2 YEARS","15","DC34713","INFANT TODDLER","GDC","Child Care - Infants/Toddlers","3255776",,"2019-08-19T12:38:30.000","Y","33.3333","17.4391","2","8.4034","33.3333","4.9984","33.3333","15.3835","2022-11-07T00:00:00.000","Exits and other egress Not provided with required signage at time of inspection.","CRITICAL","47.59(a)","CORRECTED","Initial Annual Inspection - Reinspection Required"
"THE YOUNG MEN'S AND YOUNG WOMEN'S HEBREW ASSOCIATION","THE YOUNG MEN'S AND YOUNG WOMEN'S HEBREW ASSOCIATION","1395","LEXINGTON AVENUE","MANHATTAN","10128","212-415-5532","1940","2024-06-13T00:00:00.000","Permitted","2 YEARS - 5 YEARS","171","DC2408","PRESCHOOL","GDC","Child Care - Pre School","1048310","www.92NY.ORG","2004-04-29T00:00:00.000","N","25","21.905","33","11.9769","0","6.1285","25","18.9541","2021-11-29T00:00:00.000","Adequate space/arrangement to provide separate storage areas for children's outer garments Not provided or maintained at time of inspection.","GENERAL","47.55(c)","CORRECTED","Monitoring Inspection Non-Routine - Reinspection Not Required"
"OUR CHILDREN FIRST, INC","OUR CHILDREN FIRST, INC","1180","East 214 Street","BRONX","10469","347-913-4367","104771","2023-03-29T00:00:00.000","Expired-In Renewal","2 YEARS - 5 YEARS","30","DC37765","PRESCHOOL","GDC","Child Care - Pre School","2059823","www.ocfnyc.com","2019-03-29T09:16:32.000","Y","80","21.905","14","11.9769","20","6.1285","60","18.9541","2022-09-13T00:00:00.000","At time of inspection it was determined that child care service failed to ensure staff received required training within time frames and/or failed to maintain training records.","CRITICAL","47.37(b)(1)","CORRECTED","Initial Annual Inspection - Reinspection Required; Fines pending"
"BRIGHT BEGINNINGS","BRITE ADVENTURE CENTER, INC.","86-25","162 STREET","QUEENS","11432","718-297-6767","5976","2023-06-01T00:00:00.000","Permitted",,"35","DC12382","INFANT TODDLER","GDC","Child Care - Infants/Toddlers","4209097",,"1994-05-31T00:00:00.000","Y","20","17.4391","19","8.4034","0","4.9984","20","15.3835","2023-02-10T00:00:00.000","Written Safety Plan does Not include safe sleep provisions","GENERAL","47.11(b)(7)","CORRECTED","Initial Annual Inspection - Reinspection Required; Fines pending"
"YELED V' YALDA EARLY CHILDHOOD CENTER INC.","YELED V' YALDA EARLY CHILDHOOD CENTER INC.","585","MARCY AVE","BROOKLYN","11206","347-224-1575","105343","2023-05-20T00:00:00.000","Permitted","2 YEARS - 5 YEARS","96","DC39896","PRESCHOOL","GDC","Child Care - Pre School","3048637","www.yeled.org","2021-05-20T12:49:01.000","Y","100","21.905","13","11.9769","100","6.1285","0","18.9541","2022-10-25T00:00:00.000","There were no new violations observed at the time of this inspection/visit.",,,"N/A","Compliance Inspection of Open Violations - Reinspection Required"
"BROOKLYN FRIENDS SCHOOL","BROOKLYN FRIENDS SCHOOL PRESCHOOL","375","PEARL STREET","BROOKLYN","11201","718-852-1029",,"2115-01-23T00:00:00.000","Active","3 YEARS - 5 YEARS","10","DC14472","PRESCHOOL","SBCC","School Based Child Care","3000261",,,,"66.6667","45.1817","14","8.0094","0","23.3017","66.6667","35.2291","2021-11-18T00:00:00.000","SBCC made written inquiry to last 3 employers of applicants for jobs","GENERAL","43.13(g)(3)(i)","CORRECTED","Initial Annual Inspection - Reinspection Required; Fines pending"
"ST. BARTHOLOMEW COMMUNITY PRE-SCHOOL FOUNDATION","ST. BARTHOLOMEW COMMUNITY PRE-SCHOOL FOUNDATION","109","EAST 50 STREET","MANHATTAN","10022","212-378-0238","4366","2024-09-14T00:00:00.000","Permitted","2 YEARS - 5 YEARS","80","DC2646","PRESCHOOL","GDC","Child Care - Pre School","1036450","www.stbarts.org/preschool","2004-05-17T00:00:00.000","N","0","21.905","15","11.9769","0","6.1285","0","18.9541","2020-09-22T00:00:00.000","There were no new violations observed at the time of this inspection/visit.",,,"N/A","Initial Annual Inspection - Passed inspection with no violations"
"BNOS SPINKA BOYS SCHOOL","BNOS SPINKA BOYS SCHOOL","799","KENT  AVENUE","BROOKLYN","11205","718-254-8005",,"2115-01-23T00:00:00.000","Active","3 YEARS - 5 YEARS","0","DC22778","PRESCHOOL","SBCC","School Based Child Care","3054201",,,,,,"1","8.0094",,,,,,,,,,
"MANHATTAN CHRISTIAN ACADEMY","MANHATTAN CHRISTIAN ACADEMY","401","WEST 205 STREET","MANHATTAN","10034","212-567-5521",,"2116-04-20T00:00:00.000","Active","3 YEARS - 5 YEARS","0","DC32799","PRESCHOOL","SBCC","School Based Child Care","1064504",,,,"33.3333","45.1817","2","8.0094","33.3333","23.3017","0","35.2291","2021-12-14T00:00:00.000","There were no new violations observed at the time of this inspection/visit.",,,"N/A","Initial Annual Inspection - Passed inspection with no violations"
