"contract_id","contract_number","start_date","end_date","amount","fiscal_year","purpose","program_id","provider_id","agency_name"
"433","CT126020201413669","2019-07-01T00:00:00.000","2020-06-30T00:00:00.000","14500","FY2020","To fund veterinary services.","264","330","DYCD"
"434","CT106920201411991","2019-07-01T00:00:00.000","2020-06-30T00:00:00.000","30000","FY2020","Provision of Immigrant Opportunities Initiative","120","207","DSS"
"435","CT126020201413531","2019-07-01T00:00:00.000","2020-06-30T00:00:00.000","10000","FY2020","Funds will be used to support Immigration Services","264","331","DYCD"
"436","CT126020201411149","2019-07-01T00:00:00.000","2020-06-30T00:00:00.000","25000","FY2020","To provide food pantry programs for families in need","264","332","DYCD"
"437","CT126020201413518","2019-07-01T00:00:00.000","2020-06-30T00:00:00.000","5000","FY2020","this program offers assistance, welfare and housing.","264","333","DYCD"
"438","CT126020201412918","2019-07-01T00:00:00.000","2020-06-30T00:00:00.000","20000","FY2020","To provide leadership development training programs","264","101","DYCD"
"439","CT126020201411285","2019-07-01T00:00:00.000","2020-06-30T00:00:00.000","26000","FY2020","FUND STREET CLEANING AND BEAUTIFICATION PROJECTS.","264","155","DYCD"
"440","CT126020201413606","2019-07-01T00:00:00.000","2020-06-30T00:00:00.000","20000","FY2020","Provide computer  based training and learning District 51","264","334","DYCD"
"441","CT126020201411267","2019-07-01T00:00:00.000","2020-06-30T00:00:00.000","150000","FY2020","To provide adult literacy English classes","273","335","DYCD"
"442","CT126020201408901","2019-07-01T00:00:00.000","2020-06-30T00:00:00.000","237797","FY2020","Support career readiness training for residents of the NYCHA","264","336","DYCD"
"443","CT126020201411899","2019-07-01T00:00:00.000","2020-06-30T00:00:00.000","122000","FY2020","Funds will be used to support technical training","264","336","DYCD"
"444","CT126020201413249","2019-07-01T00:00:00.000","2020-06-30T00:00:00.000","7000","FY2020","To support DJ, music production, photo & video creation, etc","264","337","DYCD"
"445","CT126020201411500","2019-07-01T00:00:00.000","2020-06-30T00:00:00.000","61000","FY2020","Funding to support youth education programming","264","146","DYCD"
"446","CT126020201410441","2019-07-01T00:00:00.000","2020-06-30T00:00:00.000","1000000","FY2020","TO SUPPORT 25 FOOD & HYGIENE PANTRIES IN PUBLIC SCHOOLS.","264","44","DYCD"
"447","CT126020201413171","2019-07-01T00:00:00.000","2020-06-30T00:00:00.000","10000","FY2020","Funding used to support basic literacy and education.","264","200","DYCD"
"448","CT126020201411566","2019-07-01T00:00:00.000","2020-06-30T00:00:00.000","25000","FY2020","Funding will support the Health & Wellness Expo.","264","338","DYCD"
"449","CT126020201409912","2019-07-01T00:00:00.000","2020-06-30T00:00:00.000","46000","FY2020","This program offers computer training and mentoring.","264","314","DYCD"
"450","CT126020201408283","2019-07-01T00:00:00.000","2020-06-30T00:00:00.000","200000","FY2020","Program support health and human service to LGBT families","264","339","DYCD"
"452","CT126020201409533","2019-07-01T00:00:00.000","2020-06-30T00:00:00.000","40000","FY2020","Provide afterschool services at PS126","264","340","DYCD"
"453","CT126020201409631","2019-07-01T00:00:00.000","2020-06-30T00:00:00.000","133000","FY2020","Funds for the after school education college prep program.","264","341","DYCD"
"454","CT181620201412182","2019-07-01T00:00:00.000","2020-06-30T00:00:00.000","65500","FY2020","Special Sports Athletic Program: Member Items","297","63","DOHMH"
"455","CT181620201412453","2019-07-01T00:00:00.000","2020-06-30T00:00:00.000","531103","FY2020","Opioid Prevention/ Treatment: Developmental, Psychological","453","342","DOHMH"
"456","CT181620201410606","2019-09-01T00:00:00.000","2028-06-30T00:00:00.000","10003110","FY2020","Permanent & supportive affordable housing for families.","311","11","DOHMH"
"457","CT106920201411284","2017-04-01T00:00:00.000","2020-03-31T00:00:00.000","1","FY2020","Provision of Home Care Services for HCPS clients","132","343","DSS"
"458","CT126020201410217","2019-07-01T00:00:00.000","2020-06-30T00:00:00.000","47500","FY2020","Food pantry program and other social service programs.","264","344","DYCD"
"459","CT126020201411362","2019-07-01T00:00:00.000","2020-06-30T00:00:00.000","46900","FY2020","Fund food to over 275 pantries and soup kitchens citywide","264","345","DYCD"
"460","CT126020201407367","2019-07-01T00:00:00.000","2020-06-30T00:00:00.000","150000","FY2020","To support a Eating for Good Health Program","264","346","DYCD"
"461","CT126020201411029","2019-07-01T00:00:00.000","2020-06-30T00:00:00.000","25000","FY2020","Educational, Recreational and Social programming.","264","347","DYCD"
"462","CT181620201412421","2019-07-01T00:00:00.000","2020-06-30T00:00:00.000","206938","FY2020","Autism Awareness / Member Items","297","250","DOHMH"
"463","CT126020201407085","2019-07-01T00:00:00.000","2020-06-30T00:00:00.000","5000","FY2020","To support youth 8-12 who participate in musical theatre","264","348","DYCD"
"465","CT126020201408913","2019-07-01T00:00:00.000","2020-06-30T00:00:00.000","14000","FY2020","To support Caribbean Heritage summer workshop series.","264","350","DYCD"
"466","CT126020201410414","2019-09-01T00:00:00.000","2020-08-31T00:00:00.000","470758","FY2020","COMPASS Middle School program. at Tompkins Square  M839","279","311","DYCD"
"467","CT126020201412406","2019-07-01T00:00:00.000","2020-06-30T00:00:00.000","15000","FY2020","To provide funding for community events.","264","292","DYCD"
"468","CT126020201412543","2019-07-01T00:00:00.000","2020-06-30T00:00:00.000","18500","FY2020","To provide Job training and Youth Services","264","31","DYCD"
"470","CT126020201411032","2019-07-01T00:00:00.000","2020-06-30T00:00:00.000","21000","FY2020","Funding will support free, comprehensive legal services","264","352","DYCD"
"472","CT126020201409153","2019-07-01T00:00:00.000","2020-06-30T00:00:00.000","750000","FY2020","Funds for Health and human services for the LBGT community","264","354","DYCD"
"473","CT181620201411642","2019-07-01T00:00:00.000","2020-06-30T00:00:00.000","147132","FY2020","Autism Awareness","297","355","DOHMH"
"474","CT181620201411716","2019-07-01T00:00:00.000","2020-06-30T00:00:00.000","270000","FY2020","Court-Involved Youth MH Initiative / Opioid prevention","453","356","DOHMH"
"475","CT126020201411179","2019-07-01T00:00:00.000","2020-06-30T00:00:00.000","75000","FY2020","To support college readiness and educational programs","264","145","DYCD"
"476","CT126020201409365","2019-07-01T00:00:00.000","2020-06-30T00:00:00.000","122500","FY2020","Funs to support education trainings and workshops.","264","354","DYCD"
"479","CT126020201409966","2019-07-01T00:00:00.000","2020-06-30T00:00:00.000","23000","FY2020","To support Youth Leadership & Career Pathway program.","264","359","DYCD"
"481","CT126020201410686","2019-07-01T00:00:00.000","2020-06-30T00:00:00.000","35000","FY2020","Provides food to over 275 pantries &soup kitchens citywide.","264","360","DYCD"
"482","CT106920201411479","2019-07-01T00:00:00.000","2020-06-30T00:00:00.000","47500","FY2020","Provision of Legal Services for the Working Poor.","120","1","DSS"
"483","CT126020201411298","2019-07-01T00:00:00.000","2020-06-30T00:00:00.000","309500","FY2020","To support after school and community programming.","264","361","DYCD"
"484","CT106920201411988","2019-07-01T00:00:00.000","2020-06-30T00:00:00.000","5000","FY2020","Provision to support anti-eviction legal services","120","190","DSS"
"485","CT112520201411540","2019-12-01T00:00:00.000","2021-06-30T00:00:00.000","686584","FY2020","PROVIDE SENIOR CENTER SERVICES TO OLDER ADULTS","464","353","DFTA"
"486","CT126020201410907","2019-07-01T00:00:00.000","2020-06-30T00:00:00.000","15000","FY2020","To support educational and recreational programs","264","362","DYCD"
"490","CT126020201410625","2019-07-01T00:00:00.000","2020-06-20T00:00:00.000","25000","FY2020","To support Literacy and HS Equivalency for adults.","264","361","DYCD"
"491","CT126020201408298","2018-07-01T00:00:00.000","2020-06-30T00:00:00.000","166952","FY2020","To assist participants take action accessing housing/benefit","276","363","DYCD"
"492","CT181620201411641","2019-07-01T00:00:00.000","2020-06-30T00:00:00.000","55000","FY2020","Autism Awareness","297","364","DOHMH"
"493","CT126020201412575","2019-07-01T00:00:00.000","2020-06-30T00:00:00.000","8000","FY2020","Funding to support the youth & senior program in Atlantic Te","264","365","DYCD"
"494","CT126020201413067","2019-07-01T00:00:00.000","2020-06-30T00:00:00.000","9000","FY2020","Cover administrative and operational expenses.","264","366","DYCD"
"496","CT126020201411034","2019-07-01T00:00:00.000","2020-06-30T00:00:00.000","210000","FY2020","To provide job training and placement services","264","367","DYCD"
"497","CT106920201409908","2020-01-01T00:00:00.000","2023-01-01T00:00:00.000","3315686.26","FY2020","Job Plus Services- East Harlem","121","368","DSS"
"498","CT126020201410403","2019-07-01T00:00:00.000","2022-06-30T00:00:00.000","236844","FY2020","COMPASS Explore Program providing careers to boat building.","285","106","DYCD"
"499","CT126020201412033","2019-07-01T00:00:00.000","2020-06-30T00:00:00.000","20000","FY2020","To support computer based training and learning.","264","369","DYCD"
"500","CT126020201410802","2019-07-01T00:00:00.000","2020-06-30T00:00:00.000","98831","FY2020","Funds for citywide environmental education programming.","264","370","DYCD"
"501","CT126020201404673","2019-03-11T00:00:00.000","2022-03-10T00:00:00.000","1617000","FY2020","To support Community Based SYEP Younger Youth","269","179","DYCD"
"502","CT181620201411597","2019-07-01T00:00:00.000","2020-06-30T00:00:00.000","150000","FY2020","Courts/Intervention For Juvenile In Probation System","300","371","DOHMH"
"504","CT106920201412977","2019-07-01T00:00:00.000","2020-06-30T00:00:00.000","5000","FY2020","To support the expansion of community workshops services","120","152","DSS"
"507","CT126020201409332","2019-07-01T00:00:00.000","2020-06-30T00:00:00.000","14000","FY2020","This program offers a safe haven for youth after school.","264","375","DYCD"
"508","CT126020201412226","2019-07-01T00:00:00.000","2020-06-30T00:00:00.000","5000","FY2020","To support CWNY'S resource, information and learning center.","264","376","DYCD"
"509","CT126020201412527","2019-07-01T00:00:00.000","2020-06-30T00:00:00.000","10000","FY2020","This program offers  food pantry in the community.","264","377","DYCD"
"510","CT106920201407471","2019-07-01T00:00:00.000","2020-06-30T00:00:00.000","15000","FY2020","Provision of legal and social services to the immigrant comm","120","241","DSS"
"511","CT126020201411117","2019-07-01T00:00:00.000","2020-06-30T00:00:00.000","115000","FY2020","Funds for basic literacy and High School Equivalency classes","272","378","DYCD"
"512","CT126020201407324","2019-07-01T00:00:00.000","2020-06-30T00:00:00.000","12000","FY2020","To fund community programming and activities.","264","379","DYCD"
"513","CT126020201410564","2019-07-01T00:00:00.000","2020-06-30T00:00:00.000","30000","FY2020","To support literacy, educational services & HS Equivalency.","264","145","DYCD"
"514","CT126020201410910","2019-07-01T00:00:00.000","2020-06-30T00:00:00.000","8500","FY2020","To support adult education and literacy classes","264","380","DYCD"
"515","CT181620201411015","2019-07-01T00:00:00.000","2020-06-30T00:00:00.000","149547","FY2020","Autism Awareness / Member Items","297","381","DOHMH"
"517","CT126020201409454","2019-07-01T00:00:00.000","2020-06-30T00:00:00.000","17000","FY2020","To fund Youth Group programs  with home help, tutoring etc.","264","383","DYCD"
"520","CT126020201410609","2019-07-01T00:00:00.000","2020-06-30T00:00:00.000","22500","FY2020","To support Girl Hack Programming","264","386","DYCD"
"521","CT126020201412106","2019-07-01T00:00:00.000","2020-06-30T00:00:00.000","10000","FY2020","Fund to help youth and young professionals with challenges","264","387","DYCD"
"523","CT181620201410741","2019-07-01T00:00:00.000","2020-06-30T00:00:00.000","86000","FY2020","Geriatric Mental Health","300","388","DOHMH"
"524","CT126020201408551","2019-07-01T00:00:00.000","2020-06-30T00:00:00.000","13000","FY2020","To fund the cost of piano & violin lessons for low-income","264","8","DYCD"
"526","CT181620201410502","2019-07-01T00:00:00.000","2020-06-30T00:00:00.000","380500","FY2020","Court-Involved Youth Mental Health / Medicaid Redesign","452","105","DOHMH"
"527","CT126020201411011","2019-07-01T00:00:00.000","2020-06-30T00:00:00.000","8500","FY2020","To provide after school and summer camp programs","264","389","DYCD"
"529","CT126020201410877","2019-07-01T00:00:00.000","2020-06-30T00:00:00.000","5000","FY2020","This program offers leadership training to youth.","264","390","DYCD"
"530","CT126020201409847","2019-07-01T00:00:00.000","2020-06-30T00:00:00.000","5000","FY2020","To support summer enrichment and academic  program","264","391","DYCD"
"531","CT106920201411150","2019-07-01T00:00:00.000","2020-06-30T00:00:00.000","150000","FY2020","Provision of Legal Services to low wage workers","120","1","DSS"
"532","CT106920201411255","2019-07-01T00:00:00.000","2020-06-30T00:00:00.000","40000","FY2020","Support outreach efforts & referral svcs to low-wage workers","120","392","DSS"
"533","CT126020201412171","2019-07-01T00:00:00.000","2020-06-30T00:00:00.000","15000","FY2020","To support community programs and events","264","393","DYCD"
"535","CT126020201409813","2019-07-01T00:00:00.000","2020-06-30T00:00:00.000","52500","FY2020","This program offers veterans cultural events.","264","394","DYCD"
"536","CT126020201411042","2019-07-01T00:00:00.000","2020-06-30T00:00:00.000","120000","FY2020","To support digital literacy & inclusion for exam preparation","264","174","DYCD"
"538","CT112520201410791","2019-12-02T00:00:00.000","2021-06-30T00:00:00.000","1269287","FY2020","PROVIDE SENIOR CENTER SERVICES TO OLDER ADULTS","464","396","DFTA"
"540","CT126020201410341","2019-07-01T00:00:00.000","2020-06-30T00:00:00.000","45000","FY2020","To support afterschool programs includes leadership training","264","398","DYCD"
"541","CT126020201409545","2019-07-01T00:00:00.000","2020-06-30T00:00:00.000","100000","FY2020","Support the expansion of BHC's early childhood programs","264","399","DYCD"
"542","CT126020201410683","2019-07-01T00:00:00.000","2020-06-30T00:00:00.000","60000","FY2020","To support leadership development program for young women","264","380","DYCD"
"543","CT126020201411359","2019-07-01T00:00:00.000","2020-06-30T00:00:00.000","13500","FY2020","To fund community events including Back-to-School Health Fai","264","400","DYCD"
"544","CT126020201409511","2019-09-01T00:00:00.000","2020-08-31T00:00:00.000","122559","FY2020","COMPASS Middle School prgm at Bedford Community Center","279","401","DYCD"
"546","CT126020201409960","2019-07-01T00:00:00.000","2020-06-30T00:00:00.000","5000","FY2020","To support artist fees, workshops, and cultural presentation","264","403","DYCD"
"547","CT126020201407728","2019-07-01T00:00:00.000","2020-06-30T00:00:00.000","7500","FY2020","To fund after-school programming at Boys & Girls Republic","264","38","DYCD"
"548","CT106920201410190","2019-10-01T00:00:00.000","2022-09-30T00:00:00.000","1731915","FY2020","Prov. of Maximizing Access to Federal Disability Benefits","119","30","DSS"
"549","CT126020201400934","2018-07-01T00:00:00.000","2020-06-30T00:00:00.000","1179059","FY2020","Reassignment of Out of School Youth from Central Queens YWHA","289","37","DYCD"
"550","CT126020201405417","2019-07-01T00:00:00.000","2020-06-30T00:00:00.000","103000","FY2020","Funding to support sports program and general cost expenses","264","404","DYCD"
"551","CT126020201409650","2019-07-01T00:00:00.000","2020-06-30T00:00:00.000","30000","FY2020","To provide a Greener program that improves the environment","264","405","DYCD"
"552","CT126020201409977","2019-07-01T00:00:00.000","2020-06-30T00:00:00.000","45000","FY2020","To provide a Greener program that improves the environment","264","58","DYCD"
"554","CT126020201409887","2019-07-01T00:00:00.000","2020-06-30T00:00:00.000","25000","FY2020","Funds for basic literacy, & High School Equivalency classes.","264","91","DYCD"
"555","CT126020201409856","2019-07-01T00:00:00.000","2020-06-30T00:00:00.000","55000","FY2020","Funds to support leadership development training for girls.","264","406","DYCD"
"556","CT126020201409646","2019-07-01T00:00:00.000","2020-06-30T00:00:00.000","56000","FY2020","To provide food pantry programs for families in need Citywid","264","407","DYCD"
"557","CT126020201410126","2019-07-01T00:00:00.000","2020-06-30T00:00:00.000","200000","FY2020","Funds to support the ""Nobody Ages Out"" Initiative","264","408","DYCD"
"558","CT126020201410622","2019-07-01T00:00:00.000","2020-06-30T00:00:00.000","31000","FY2020","This program offers support to the homeless veterans.","264","111","DYCD"
"561","CT106920201409543","2019-07-01T00:00:00.000","2020-06-30T00:00:00.000","100000","FY2020","Provision of civil legal services to low-wage workers in nee","120","410","DSS"
"562","CT126020201410459","2019-07-01T00:00:00.000","2020-06-30T00:00:00.000","138500","FY2020","Funds for educational cultural programs in the museum.","264","411","DYCD"
"563","CT126020201409676","2019-07-01T00:00:00.000","2020-06-30T00:00:00.000","21500","FY2020","To support community education programming.","264","412","DYCD"
"564","CT106920201411147","2019-07-01T00:00:00.000","2020-06-30T00:00:00.000","80000","FY2020","Provision of civil legal services to low-wage workers","120","312","DSS"
"567","CT126020201410052","2019-07-01T00:00:00.000","2020-06-30T00:00:00.000","30000","FY2020","This program offers environmental program  youth.","264","414","DYCD"
"568","CT126020201410547","2019-07-01T00:00:00.000","2020-06-30T00:00:00.000","50000","FY2020","To fund educational and anti-violence programs.","264","195","DYCD"
"569","CT126020201401100","2018-07-01T00:00:00.000","2020-06-30T00:00:00.000","187165","FY2020","Reassignment of Central Queens YM & YWHA due to merger","283","37","DYCD"
"570","CT126020201407713","2019-07-01T00:00:00.000","2020-06-30T00:00:00.000","100000","FY2020","To support basic literacy, ESOL, civics and GED courses.","272","1","DYCD"
"571","CT126020201404516","2019-07-01T00:00:00.000","2020-06-30T00:00:00.000","60000","FY2020","To provide support to afterschool programming","264","99","DYCD"
"572","CT126020201410668","2019-07-01T00:00:00.000","2020-06-30T00:00:00.000","5000","FY2020","To support Free Tax Prep in Council District 18.","264","415","DYCD"
"573","CT126020201409410","2019-07-01T00:00:00.000","2020-06-30T00:00:00.000","15000","FY2020","To provide recreational programming for young adults","264","335","DYCD"
"574","CT126020201409451","2019-07-01T00:00:00.000","2020-06-30T00:00:00.000","27000","FY2020","To fund Drag Queen Story Hour Reading Events.","264","416","DYCD"
"575","CT181620201411001","2019-07-01T00:00:00.000","2020-06-30T00:00:00.000","51500","FY2020","GERIATRIC MENTAL HEALTH","300","140","DOHMH"
"576","CT126020201411718","2019-07-01T00:00:00.000","2020-06-30T00:00:00.000","5000","FY2020","The program provides trauma therapy to children & caregivers","264","269","DYCD"
"577","CT126020201405643","2019-07-01T00:00:00.000","2020-06-30T00:00:00.000","190000","FY2020","To support Summer and Afterschool programming/staffing.","264","133","DYCD"
"578","CT106920201410278","2019-07-01T00:00:00.000","2020-06-30T00:00:00.000","45000","FY2020","Provision of Immigrant Opportunities Initiative Services","120","133","DSS"
"579","CT181620201410921","2019-07-01T00:00:00.000","2020-06-30T00:00:00.000","293269","FY2020","Autism Awareness / Children Under Five","452","365","DOHMH"
"580","CT181620201410953","2019-07-01T00:00:00.000","2020-06-30T00:00:00.000","273103","FY2020","Developmental, Psychological and Behavioral Health Services","325","106","DOHMH"
"581","CT181620201410638","2019-07-01T00:00:00.000","2020-06-30T00:00:00.000","354603","FY2020","Medicaid Redesign Transition / Member Items","300","417","DOHMH"
"582","CT181620201410563","2019-07-01T00:00:00.000","2020-06-30T00:00:00.000","49000","FY2020","Health and wellness education/awareness etc","300","418","DOHMH"
"584","CT181620201410538","2019-07-01T00:00:00.000","2020-06-30T00:00:00.000","36103","FY2020","Developmental, Psychological and Behavioral Health Services","302","124","DOHMH"
"586","CT126020201407968","2019-07-01T00:00:00.000","2020-06-30T00:00:00.000","70000","FY2020","To fund afterschool program for   youth debate training.","264","25","DYCD"
"587","CT126020201408806","2019-07-01T00:00:00.000","2020-06-30T00:00:00.000","100000","FY2020","To fund leadership development training programs for youth.","264","420","DYCD"
"588","CT126020201401099","2018-07-01T00:00:00.000","2021-06-30T00:00:00.000","1245468","FY2021","Reassignment of Central Queens YM & YWHA due to merger","279","37","DYCD"
"589","CT181620201410637","2019-07-01T00:00:00.000","2020-06-30T00:00:00.000","50000","FY2020","Opioid Prevention and Treatment","302","421","DOHMH"
"591","CT126020201409851","2019-07-01T00:00:00.000","2020-06-30T00:00:00.000","30000","FY2020","To support greener NYC programs.","264","423","DYCD"
"592","CT126020201409849","2019-07-01T00:00:00.000","2020-06-30T00:00:00.000","40000","FY2020","Funds will be used to support a Youth Development program","264","334","DYCD"
"593","CT106920201410444","2019-07-01T00:00:00.000","2020-06-30T00:00:00.000","84000","FY2020","Provision of Immigrant Opportunities Initiative Services","120","424","DSS"
"594","CT106920201410307","2019-10-01T00:00:00.000","2022-09-30T00:00:00.000","2116685","FY2020","Provision of Maximizing Access to Federal Disability Benefit","119","30","DSS"
"596","CT181620201410561","2019-07-01T00:00:00.000","2020-06-30T00:00:00.000","86000","FY2020","Screen older adults for depression and alcohol/substance use","300","40","DOHMH"
"599","CT126020201410201","2019-07-01T00:00:00.000","2020-06-30T00:00:00.000","10000","FY2020","To support educational workshops  and events.","264","427","DYCD"
"600","CT126020201409848","2019-07-01T00:00:00.000","2020-06-30T00:00:00.000","5000","FY2020","To support summer day camp and youth services.","264","428","DYCD"
"601","CT126020201411176","2019-07-01T00:00:00.000","2020-06-30T00:00:00.000","14500","FY2020","Funding will support general operating costs at TADA!","264","429","DYCD"
"602","CT126020201411476","2019-07-01T00:00:00.000","2020-06-30T00:00:00.000","10000","FY2020","To fund after school services for children.","264","430","DYCD"
"603","CT126020201409331","2019-07-01T00:00:00.000","2020-06-30T00:00:00.000","10000","FY2020","This program offers food pantries and soup kitchens citywide","264","431","DYCD"
"605","CT126020201408267","2019-07-01T00:00:00.000","2020-06-30T00:00:00.000","47500","FY2020","To support therapeutic events for patients fight illnesses","264","432","DYCD"
"607","CT106920201409452","2019-07-01T00:00:00.000","2020-06-30T00:00:00.000","125000","FY2020","Provision of funding to support the agency's immigration.","120","241","DSS"
"614","CT106920201410277","2019-07-01T00:00:00.000","2020-06-30T00:00:00.000","750000","FY2020","Provision of Legal Services for Low-Income New Yorkers.","120","21","DSS"
"615","CT106920201410999","2019-07-01T00:00:00.000","2020-06-30T00:00:00.000","10000","FY2020","Prov. to support operating expenses associated w/ Immigrant","120","439","DSS"
"616","CT181620201410472","2019-07-01T00:00:00.000","2020-06-30T00:00:00.000","122000","FY2020","Geriatric Mental Health:depression and alcohol/substance use","300","45","DOHMH"
"617","CT106920201410067","2019-07-01T00:00:00.000","2020-06-30T00:00:00.000","27000","FY2020","Provision of Immigrant Opportunities Services","120","150","DSS"
"619","CT106920201407758","2019-07-01T00:00:00.000","2020-06-30T00:00:00.000","200000","FY2020","Provision of Immigrant Opportunities Initiative services.","120","440","DSS"
"620","CT106920201410777","2019-07-01T00:00:00.000","2020-06-30T00:00:00.000","115000","FY2020","Provision of Legal Representation, Advocacy, and Tenant & Co","120","441","DSS"
"621","CT126020201410624","2019-07-01T00:00:00.000","2020-06-30T00:00:00.000","20000","FY2020","To support computer digital inclusion programing in 51 CDs.","264","361","DYCD"
"622","CT106920201410786","2019-07-01T00:00:00.000","2020-06-30T00:00:00.000","37777","FY2020","Legal support for Bx residents in USCIS immigration court","120","442","DSS"
"624","CT106920201409934","2019-07-01T00:00:00.000","2020-06-30T00:00:00.000","65000","FY2020","Provision of Immigrant Opportunities Initiative Services","120","360","DSS"
"625","CT106920201410776","2019-07-01T00:00:00.000","2020-06-30T00:00:00.000","50000","FY2020","Provision of funding to support outreach to low-wage workers","120","30","DSS"
"626","CT181620201409902","2019-07-01T00:00:00.000","2020-06-30T00:00:00.000","50000","FY2020","Instructional & recreational service for Autism children","297","443","DOHMH"
"627","CT106920201409456","2019-07-01T00:00:00.000","2020-06-30T00:00:00.000","50000","FY2020","Provision supports legal and social services through the Bro","120","442","DSS"
"629","CT126020201408117","2019-07-01T00:00:00.000","2022-06-30T00:00:00.000","13173654","FY2020","Rutgers Community Center College Prep","281","444","DYCD"
"630","CT126020201406981","2019-09-01T00:00:00.000","2020-08-31T00:00:00.000","568078","FY2020","COMPASS Elementary at 51 Avenue Academy (Q877)","271","68","DYCD"
"631","CT126020201409122","2019-07-01T00:00:00.000","2020-06-30T00:00:00.000","250000","FY2020","To support a range of services to empower the TGNC community","264","149","DYCD"
