"contract_id","contract_number","start_date","end_date","amount","fiscal_year","purpose","program_id","provider_id","agency_name"
"633","CT126020201409317","2019-07-01T00:00:00.000","2020-06-30T00:00:00.000","5000","FY2020","To provide after-school homework help","264","292","DYCD"
"634","CT106920201409546","2019-07-01T00:00:00.000","2020-06-30T00:00:00.000","455000","FY2020","Provision of legal services for the working poor.","120","265","DSS"
"635","CT106920201410022","2019-07-01T00:00:00.000","2020-06-30T00:00:00.000","2000000","FY2020","Provision of Legal Services for Low-Income New Yorkers","120","446","DSS"
"636","CT126020201407726","2019-09-01T00:00:00.000","2020-08-31T00:00:00.000","760972","FY2020","COMPASS Middle school program at Conselyea prep school","279","447","DYCD"
"637","CT126020201408151","2019-07-01T00:00:00.000","2020-06-30T00:00:00.000","100000","FY2020","To provide adult literacy & ESOL services","400","448","DYCD"
"638","CT181620201409138","2019-07-01T00:00:00.000","2020-06-30T00:00:00.000","72183","FY2020","Recreational/Socialization Services -Autism Spectrum Disorde","297","449","DOHMH"
"639","CT126020201407463","2019-07-01T00:00:00.000","2020-06-30T00:00:00.000","80000","FY2020","To support recreational programming in CD37","264","197","DYCD"
"640","CT126020201408896","2019-07-01T00:00:00.000","2020-06-30T00:00:00.000","20000","FY2020","Provide computer based training & learning, technical skill","264","336","DYCD"
"641","CT126020201410914","2019-07-01T00:00:00.000","2020-06-30T00:00:00.000","20000","FY2020","To cover administrative and operational costs of league","264","450","DYCD"
"642","CT126020201408900","2019-07-01T00:00:00.000","2020-06-30T00:00:00.000","10000","FY2020","To train under/unemployed individuals, for careers in the IT","264","336","DYCD"
"643","CT126020201410804","2019-07-01T00:00:00.000","2020-06-30T00:00:00.000","10000","FY2020","Funding for the Hodori Little Tiger Afterschool program.","264","406","DYCD"
"645","CT126020201411073","2019-07-01T00:00:00.000","2020-06-30T00:00:00.000","4000","FY2020","This program support workshop on health fitness and sports","264","16","DYCD"
"646","CT126020201410909","2019-07-01T00:00:00.000","2020-06-30T00:00:00.000","10000","FY2020","Funds will support college access and career development","264","16","DYCD"
"647","CT126020201411296","2019-07-01T00:00:00.000","2020-06-30T00:00:00.000","10000","FY2020","This program support counseling services for Young Adults","264","16","DYCD"
"649","CT126020201411416","2019-07-01T00:00:00.000","2020-06-30T00:00:00.000","10000","FY2020","To provide funding for a food pantry and nutrition program.","264","243","DYCD"
"650","CT126020201403499","2019-03-11T00:00:00.000","2022-03-10T00:00:00.000","678950","FY2020","To support Community Based SYEP Older Youth","399","453","DYCD"
"651","CT126020201404051","2019-03-11T00:00:00.000","2022-03-10T00:00:00.000","810000","FY2020","To support Community Based SYEP Younger Youth","269","453","DYCD"
"653","CT126020201410726","2019-07-01T00:00:00.000","2020-06-30T00:00:00.000","6000","FY2020","Support outreach and social service programming of SCM","264","360","DYCD"
"654","CT126020201411071","2019-07-01T00:00:00.000","2020-06-30T00:00:00.000","3000","FY2020","This program support swimming lesson for second grade","264","16","DYCD"
"655","CT126020201410727","2019-07-01T00:00:00.000","2020-06-30T00:00:00.000","13000","FY2020","Funds will support uniforms and transportation of youth team","264","455","DYCD"
"656","CT126020201409498","2019-07-01T00:00:00.000","2020-06-30T00:00:00.000","100000","FY2020","To support basic literacy, ESL and GED classes for adults","272","81","DYCD"
"657","CT112520201409496","2019-12-01T00:00:00.000","2021-06-30T00:00:00.000","1488392","FY2020","PROVIDE SENIOR CENTER SERVICES TO OLDER ADULTS","464","456","DFTA"
"659","CT181620201409871","2019-07-01T00:00:00.000","2020-06-30T00:00:00.000","197372","FY2020","Recreational/Socialization Services -hiring of staff members","297","457","DOHMH"
"660","CT126020201410911","2019-07-01T00:00:00.000","2020-06-30T00:00:00.000","15000","FY2020","This program support the summer and after school programs","264","16","DYCD"
"661","CT126020201410321","2019-07-01T00:00:00.000","2020-06-30T00:00:00.000","20000","FY2020","To support Adult ESOL programs and Youth Employment programs","264","218","DYCD"
"662","CT126020201406631","2019-07-01T00:00:00.000","2020-06-30T00:00:00.000","37000","FY2020","Support programming that addresses At Risk Latina Teens.","264","171","DYCD"
"663","CT126020201407370","2019-07-01T00:00:00.000","2020-06-30T00:00:00.000","10000","FY2020","Funds to support programs at Astoria Houses Comm Ctr.","264","65","DYCD"
"664","CT106920201407834","2019-07-01T00:00:00.000","2020-06-30T00:00:00.000","55000","FY2020","Provision of Mobile Legal Centers.","120","21","DSS"
"665","CT106920201409593","2019-07-01T00:00:00.000","2020-06-30T00:00:00.000","53000","FY2020","Provision of Immigrant Opportunities Initiative Services.","120","458","DSS"
"666","CT106920201411254","2019-07-01T00:00:00.000","2020-06-30T00:00:00.000","17500","FY2020","To support the Family Law and Community Outreach programs.","120","96","DSS"
"667","CT126020201408237","2019-07-01T00:00:00.000","2020-06-30T00:00:00.000","95000","FY2020","To support NTRP's public programs including educational","264","459","DYCD"
"668","CT106920201409097","2019-07-01T00:00:00.000","2020-06-30T00:00:00.000","150000","FY2020","Provision of legal services for the working poor","120","198","DSS"
"669","CT106920201408899","2019-10-01T00:00:00.000","2022-09-30T00:00:00.000","2115302.9","FY2020","Max. Access to Fed. Disability Benefit-Bronx, Manhattan, SI","119","446","DSS"
"670","CT126020201406626","2019-07-01T00:00:00.000","2020-06-30T00:00:00.000","2074476","FY2020","To fund NYC Cleanup Initiative for Districts beautification.","264","155","DYCD"
"671","CT126020201410682","2019-07-01T00:00:00.000","2020-06-30T00:00:00.000","20000","FY2020","supports capacity building and immigrant outreach community","264","246","DYCD"
"673","CT126020201410236","2019-07-01T00:00:00.000","2020-06-30T00:00:00.000","10000","FY2020","To support ""Connect for Success"",  attendance intervention.","264","461","DYCD"
"674","CT126020201410744","2019-07-01T00:00:00.000","2020-06-30T00:00:00.000","20000","FY2020","To fund mental health and health services for youth.","264","458","DYCD"
"675","CT126020201405612","2019-03-11T00:00:00.000","2022-03-10T00:00:00.000","527500","FY2020","To support Community Based SYEP Older Youth","399","462","DYCD"
"676","CT181620201409796","2019-07-01T00:00:00.000","2020-06-30T00:00:00.000","100000","FY2020","Mental Health Services for Vulnerable Populations","300","463","DOHMH"
"678","CT106920201409098","2019-07-01T00:00:00.000","2020-06-30T00:00:00.000","300000","FY2020","Provision of legal services for the working poor.","120","465","DSS"
"679","CT126020201402446","2019-07-01T00:00:00.000","2022-06-30T00:00:00.000","146034","FY2020","To provide peer support and guidance to participants.","286","466","DYCD"
"682","CT126020201407465","2019-07-01T00:00:00.000","2020-06-30T00:00:00.000","5000","FY2020","To support operational expenses for Bushwick Farmers Market","264","197","DYCD"
"683","CT106920201408904","2019-07-01T00:00:00.000","2020-06-30T00:00:00.000","38000","FY2020","Provision of Immigrant Opportunities Initiative Services","120","265","DSS"
"684","CT126020201409842","2019-07-01T00:00:00.000","2020-06-30T00:00:00.000","5000","FY2020","To support mentoring, life skills and advocacy for girls.","264","467","DYCD"
"685","CT126020201408207","2019-07-01T00:00:00.000","2020-06-30T00:00:00.000","80000","FY2020","To provide environmentally friendly focused programs.","264","459","DYCD"
"686","CT126020201410906","2019-07-01T00:00:00.000","2020-06-30T00:00:00.000","20000","FY2020","To support capacity building of nonprofit human providers","264","380","DYCD"
"687","CT126020201408506","2019-07-01T00:00:00.000","2020-06-30T00:00:00.000","131000","FY2020","TO SUPPORT COMMUNITY BASED PLANNING AND ORGANIZATION","264","468","DYCD"
"689","CT181620200002482","2019-07-01T00:00:00.000","2020-06-30T00:00:00.000","3993268","FY2020","Family Support Services","331","397","DOHMH"
"690","CT126020201409921","2019-07-01T00:00:00.000","2020-06-30T00:00:00.000","5000","FY2020","To fund the Teens Center's programs to empower youth,","264","71","DYCD"
"691","CT126020201408737","2019-03-11T00:00:00.000","2022-03-10T00:00:00.000","543550","FY2020","To support Community Based SYEP Older Youth","399","29","DYCD"
"692","CT126020201409888","2019-07-01T00:00:00.000","2020-06-30T00:00:00.000","15000","FY2020","Funds to support the Afterschool & Summer Camp programs.","264","91","DYCD"
"693","CT126020201410696","2019-07-01T00:00:00.000","2020-06-30T00:00:00.000","5000","FY2020","To fund annual Atlantic Antic Festival.","264","470","DYCD"
"694","CT126020201407730","2019-07-01T00:00:00.000","2020-06-30T00:00:00.000","30000","FY2020","To support after-school information and preventive workshop","264","471","DYCD"
"695","CT126020201405853","2019-07-01T00:00:00.000","2020-06-30T00:00:00.000","185000","FY2020","To support literacy program for adults.","272","472","DYCD"
"696","CT126020201408286","2019-07-01T00:00:00.000","2020-06-30T00:00:00.000","64333","FY2020","Help children achieve reading proficiency by 3rd grade.","264","399","DYCD"
"697","CT126020201408733","2019-07-01T00:00:00.000","2020-03-10T00:00:00.000","963000","FY2020","To support Special Initiatives SYEP Vulnerable Youth","270","29","DYCD"
"699","CT126020201408765","2019-07-01T00:00:00.000","2020-06-30T00:00:00.000","5000","FY2020","To fund career services and job readiness programming.","264","473","DYCD"
"700","CT126020201410552","2019-07-01T00:00:00.000","2020-06-30T00:00:00.000","15000","FY2020","To fund Holocaust Remembrance day events.","264","474","DYCD"
"701","CT126020201408523","2019-07-01T00:00:00.000","2020-06-30T00:00:00.000","99900","FY2020","TO SUPPORT BASIC LITERACY FOR SPEAKERS OF OTHER LANGUAGES","272","468","DYCD"
"702","CT126020201405851","2019-07-01T00:00:00.000","2020-06-30T00:00:00.000","129500","FY2020","To support educational programming for adults","272","380","DYCD"
"703","CT126020201410489","2019-07-01T00:00:00.000","2020-06-30T00:00:00.000","12000","FY2020","To fund monthly meetings and eventsof Maspeth communities.","264","475","DYCD"
"704","CT181620201409213","2019-07-01T00:00:00.000","2020-06-30T00:00:00.000","87250","FY2020","Transition services young adults Autism Spectrum Disorder","300","476","DOHMH"
"708","CT126020201409916","2019-07-01T00:00:00.000","2020-06-30T00:00:00.000","10000","FY2020","To support youth sports programming.","264","478","DYCD"
"709","CT126020201407849","2019-09-01T00:00:00.000","2020-08-31T00:00:00.000","460050","FY2020","Compass Elementary School program at PS 107 (x107)","271","479","DYCD"
"710","CT106920201408587","2019-07-01T00:00:00.000","2020-06-30T00:00:00.000","440000","FY2020","Provision of Immigrant Opportunities Initiative Services","120","21","DSS"
"713","CT181620201408767","2019-07-01T00:00:00.000","2020-06-30T00:00:00.000","81000","FY2020","Screen older adults for depression and alcohol/substance use","300","296","DOHMH"
"714","CT126020201409422","2019-07-01T00:00:00.000","2020-06-30T00:00:00.000","5000","FY2020","Support free programming for children at LIC Landing.","264","480","DYCD"
"716","CT106920201408686","2019-07-01T00:00:00.000","2020-06-30T00:00:00.000","50000","FY2020","Provision of funds for Justice for Immigrants & legal svcs.","120","481","DSS"
"717","CT106920201408990","2019-07-01T00:00:00.000","2020-06-30T00:00:00.000","300000","FY2020","Provision of Legal Supportive Alternatives to Violence","120","481","DSS"
"718","CT106920201408776","2019-07-01T00:00:00.000","2020-06-30T00:00:00.000","425000","FY2020","Provision of Immigrant Opportunities Initiative Services","120","446","DSS"
"720","CT126020201404518","2019-07-01T00:00:00.000","2020-06-30T00:00:00.000","15000","FY2020","To provide programming for the National Night Out","264","99","DYCD"
"721","CT181620201409211","2019-07-01T00:00:00.000","2020-06-30T00:00:00.000","70031","FY2020","After school, summer programs; trainings/seminars families","300","482","DOHMH"
"723","CT126020201407284","2019-07-01T00:00:00.000","2020-06-30T00:00:00.000","150250","FY2020","To support adult literacy and civics programming.","272","80","DYCD"
"724","CT106920201408777","2019-07-01T00:00:00.000","2020-06-30T00:00:00.000","25000","FY2020","Provision of Immigrant Opportunities Initiative Services","120","357","DSS"
"725","CT126020201408419","2019-09-01T00:00:00.000","2020-08-31T00:00:00.000","457765","FY2020","COMPASS Elementary program at PS 019 Roberto Clemente","271","461","DYCD"
"726","CT126020201407461","2019-07-01T00:00:00.000","2020-06-30T00:00:00.000","18500","FY2020","To support reading proficiency in schools/ medical settings","264","325","DYCD"
"727","CT126020201409976","2019-07-01T00:00:00.000","2020-06-30T00:00:00.000","20000","FY2020","Supports programming in 51 Council Districts computer base.","264","398","DYCD"
"728","CT106920201408903","2019-07-01T00:00:00.000","2020-06-30T00:00:00.000","455000","FY2020","Provision of Legal Services for the Working Poor FY20 07053","120","410","DSS"
"729","CT126020201404637","2019-07-01T00:00:00.000","2020-06-30T00:00:00.000","20000","FY2020","To support community youth program","264","99","DYCD"
"730","CT126020201409859","2019-07-01T00:00:00.000","2020-06-30T00:00:00.000","10000","FY2020","To provide culinary training and experience for teenagers","264","484","DYCD"
"731","CT126020201408150","2019-07-01T00:00:00.000","2020-06-30T00:00:00.000","10000","FY2020","Supports Free Dance Lessons, Choreography Workshops.","264","485","DYCD"
"734","CT126020201405223","2019-07-01T00:00:00.000","2022-06-30T00:00:00.000","139320","FY2020","COMPASS Explore providing after school system program","285","488","DYCD"
"739","CT126020201407276","2019-07-01T00:00:00.000","2020-06-30T00:00:00.000","23500","FY2020","To support after-school programs","264","357","DYCD"
"741","CT126020201407790","2019-07-01T00:00:00.000","2020-06-30T00:00:00.000","100000","FY2020","Support basic literacy, English for Speakers of Other Lang.","272","490","DYCD"
"742","CT106920201410282","2019-07-01T00:00:00.000","2020-06-30T00:00:00.000","5500","FY2020","Provision to support removal defense for detained immigrants","120","424","DSS"
"743","CT106920201407833","2019-07-01T00:00:00.000","2020-06-30T00:00:00.000","10000","FY2020","Provision of funds to conduct immigration screenings","120","442","DSS"
"744","CT112520201408568","2019-12-01T00:00:00.000","2021-06-30T00:00:00.000","703197","FY2020","PROVIDE SENIOR CENTER SERVICES TO OLDER ADULTS","464","491","DFTA"
"745","CT112520201408642","2019-12-01T00:00:00.000","2021-06-30T00:00:00.000","628321","FY2020","PROVIDE SENIOR CENTER SERVICES TO OLDER ADULTS","464","492","DFTA"
"746","CT112520201408641","2019-12-01T00:00:00.000","2021-06-30T00:00:00.000","1238580","FY2020","PROVIDE SENIOR CENTER SERVICES TO OLDER ADULTS","464","492","DFTA"
"748","CT126020201408065","2019-07-01T00:00:00.000","2020-06-30T00:00:00.000","50000","FY2020","To fund basic Literacy, English & HSE classes for adults.","264","329","DYCD"
"750","CT126020201401626","2019-07-01T00:00:00.000","2022-06-30T00:00:00.000","1404978","FY2020","Summer Community Center youth & adult educational services","281","461","DYCD"
"751","CT126020201402612","2019-03-11T00:00:00.000","2022-03-10T00:00:00.000","540000","FY2020","To support Special Initiatives SYEP Vulnerable Youth","270","461","DYCD"
"752","CT181620201407760","2019-07-01T00:00:00.000","2020-06-30T00:00:00.000","88263","FY2020","This allocation supports wraparound services for autistic ch","297","228","DOHMH"
"753","CT126020201407294","2019-07-01T00:00:00.000","2022-06-30T00:00:00.000","228450","FY2020","To provide STEM, literacy and Leadership activities.","286","461","DYCD"
"754","CT106920201406241","2019-10-01T00:00:00.000","2022-09-30T00:00:00.000","1731064.86","FY2020","Provision of Maximizing Access to Federal Disability Benefit","119","446","DSS"
"755","CT106920200001201","2019-07-01T00:00:00.000","2022-06-30T00:00:00.000","33738312.19","FY2020","Amendment to Immigrant Opportunity Initiative Renewal","120","30","DSS"
"756","CT126020201409421","2019-07-01T00:00:00.000","2020-06-30T00:00:00.000","8000","FY2020","Funds will be used to help support the tutoring program.","264","494","DYCD"
"757","CT126020201400621","2019-03-11T00:00:00.000","2022-03-10T00:00:00.000","955800","FY2020","To fund School Based SYEP  for Younger Youth and Older Youth","399","461","DYCD"
"758","CT126020201400622","2019-03-11T00:00:00.000","2022-03-10T00:00:00.000","1053500","FY2020","To support Community Based SYEP Older Youth","399","461","DYCD"
"759","CT126020200003452","2019-03-11T00:00:00.000","2022-03-10T00:00:00.000","274200","FY2020","To support Special Initiatives  SYEP NYCHA MAP","293","461","DYCD"
"760","CT126020201405418","2019-03-11T00:00:00.000","2022-03-10T00:00:00.000","539400","FY2020","To support Community Based SYEP Younger Youth","269","461","DYCD"
"761","CT126020201400618","2019-03-11T00:00:00.000","2022-03-10T00:00:00.000","250950","FY2020","To support Special Initiatives SYEP NYCHA MAP","293","461","DYCD"
"763","CT106920201409771","2019-07-01T00:00:00.000","2020-06-30T00:00:00.000","10000","FY2020","Provision To provide legal services for recent immigrants","120","496","DSS"
"764","CT126020201409362","2019-07-01T00:00:00.000","2020-06-30T00:00:00.000","5000","FY2020","To provide after school program at P.S. 161M and P.S. 36M.","264","35","DYCD"
"766","CT126020201407443","2019-07-01T00:00:00.000","2020-06-30T00:00:00.000","10000","FY2020","To support weekly instrumental, vocal and music sessions","264","498","DYCD"
"767","CT112520201407982","2019-12-01T00:00:00.000","2021-06-30T00:00:00.000","1578606","FY2020","PROVIDE SENIOR CENTER SERVICES TO OLDER ADULTS","464","235","DFTA"
"768","CT126020201408402","2018-07-01T00:00:00.000","2020-06-30T00:00:00.000","257162","FY2020","To provide Housing Services in Brooklyn CD14 &CD17","276","499","DYCD"
"769","CT126020201407576","2019-07-01T00:00:00.000","2020-06-30T00:00:00.000","100000","FY2020","Support basic literacy, English for speakers other languages","272","365","DYCD"
"770","CT126020201408371","2018-07-01T00:00:00.000","2020-06-30T00:00:00.000","136400","FY2020","To provide Educational Support Services in Brooklyn CD16","278","500","DYCD"
"772","CT126020201407835","2019-07-01T00:00:00.000","2020-06-30T00:00:00.000","125000","FY2020","Funds will be used for the Passage of Rites program in CD 9.","264","502","DYCD"
"773","CT126020201407688","2019-07-01T00:00:00.000","2020-06-30T00:00:00.000","101750","FY2020","Support basic literacy, English for adults of other language","400","503","DYCD"
"776","CT126020201407369","2019-07-01T00:00:00.000","2020-06-30T00:00:00.000","59000","FY2020","To support job training, child therapy, and homework help","264","65","DYCD"
"778","CT126020201408342","2018-07-01T00:00:00.000","2020-06-30T00:00:00.000","153980","FY2020","To provide Housing Services in Brooklyn CD2","276","365","DYCD"
"779","CT126020201407699","2019-07-01T00:00:00.000","2020-06-30T00:00:00.000","100000","FY2020","To support literacy for adults & speakers of other languages","272","507","DYCD"
"780","CT106920201407847","2019-07-01T00:00:00.000","2020-06-30T00:00:00.000","178000","FY2020","Provision of Immigrant Opportunities Initiative Services","120","241","DSS"
"781","CT106920201408177","2019-07-01T00:00:00.000","2020-06-30T00:00:00.000","100000","FY2020","Provision of Immigrant Opportunities Initiatives Services","120","65","DSS"
"782","CT106920201402360","2018-07-01T00:00:00.000","2021-06-30T00:00:00.000","612000","FY2020","Prov. of Legal Assistance Services for the Elderly in Queens","116","82","DSS"
"783","CT126020201406516","2019-07-01T00:00:00.000","2020-06-30T00:00:00.000","100000","FY2020","Funds to support literacy, ESL &civics education classes","272","67","DYCD"
"785","CT181620201407715","2019-07-01T00:00:00.000","2020-06-30T00:00:00.000","86000","FY2020","Geriatric Mental Health","300","91","DOHMH"
"787","CT181620201407863","2019-07-01T00:00:00.000","2020-06-30T00:00:00.000","86000","FY2020","Alcohol/substance abuse treatment for adults","300","509","DOHMH"
"788","CT181620201407999","2019-07-01T00:00:00.000","2020-06-30T00:00:00.000","90000","FY2020","Screening/Assessment & advocacy programs for youths.","300","184","DOHMH"
"789","CT106920201407637","2019-07-01T00:00:00.000","2020-06-30T00:00:00.000","126000","FY2020","provision of Immigrant Opportunities Initiative Services","120","410","DSS"
"790","CT181620201407731","2019-11-01T00:00:00.000","2025-06-30T00:00:00.000","2934000","FY2020","New York City Mural Arts Project (NYCMAP)","316","418","DOHMH"
"791","CT106920201407263","2019-04-01T00:00:00.000","2025-03-31T00:00:00.000","1620312","FY2020","Case coordination for Cluster Conversion Program","125","510","DSS"
"792","CT126020201408132","2019-07-01T00:00:00.000","2020-06-30T00:00:00.000","7000","FY2020","To support family-friendly public events","264","459","DYCD"
"793","CT126020201408763","2019-07-01T00:00:00.000","2020-06-30T00:00:00.000","15000","FY2020","Funds to support and maintain neighborhood beautification.","264","511","DYCD"
"794","CT126020201409412","2019-07-01T00:00:00.000","2020-06-30T00:00:00.000","5000","FY2020","Provide leadership enrichment workshops for youth.","264","444","DYCD"
"795","CT181620201407591","2019-07-01T00:00:00.000","2020-06-30T00:00:00.000","81000","FY2020","Screen older adults for depression & alcohol/substance abuse","300","512","DOHMH"
"796","CT106920201409587","2019-07-01T00:00:00.000","2020-06-30T00:00:00.000","5000","FY2020","Prov.support oper. expense costs for community legal assist.","120","207","DSS"
"797","CT126020201407058","2019-09-01T00:00:00.000","2020-08-31T00:00:00.000","609546","FY2020","COMPASS Elementary School Program at P.S. 225","271","227","DYCD"
"798","CT126020201402698","2019-03-11T00:00:00.000","2022-03-10T00:00:00.000","2349200","FY2020","To support Community Based SYEP Older Youth.","399","513","DYCD"
"799","CT126020201408058","2018-07-01T00:00:00.000","2020-06-30T00:00:00.000","144742","FY2020","Support Services for Housing","276","290","DYCD"
"800","CT126020201407876","2018-07-01T00:00:00.000","2020-06-30T00:00:00.000","74400","FY2020","To provide Opportunity Youth svcs in Queens","266","514","DYCD"
"801","CT126020201406826","2019-07-01T00:00:00.000","2020-06-30T00:00:00.000","9000","FY2020","This program offers childcare development and activities.","264","515","DYCD"
"802","CT126020201408986","2019-07-01T00:00:00.000","2020-06-30T00:00:00.000","13000","FY2020","To fund Immigrant health initiative for community fitness.","264","516","DYCD"
"803","CT126020201407059","2019-09-01T00:00:00.000","2020-08-31T00:00:00.000","227952","FY2020","COMPASS Middle School Program at P.S. 225","279","227","DYCD"
"804","CT126020201407336","2019-07-01T00:00:00.000","2020-06-30T00:00:00.000","5000","FY2020","Support group for individuals struggling to read, tutoring.","264","517","DYCD"
"805","CT126020201408905","2019-07-01T00:00:00.000","2020-06-30T00:00:00.000","10000","FY2020","This program  support youth at  the Ridgewood YMCA","264","16","DYCD"
"806","CT126020201409271","2019-07-01T00:00:00.000","2020-06-30T00:00:00.000","7500","FY2020","This program offers cultural arts for youth.","264","518","DYCD"
"807","CT126020201408973","2019-07-01T00:00:00.000","2020-06-30T00:00:00.000","10000","FY2020","This program support youth sports and healthy living","264","16","DYCD"
"808","CT126020201402134","2019-09-01T00:00:00.000","2020-08-31T00:00:00.000","555619","FY2020","COMPASS Elementary program at P.S. 43","271","201","DYCD"
"809","CT126020201408914","2019-07-01T00:00:00.000","2020-06-30T00:00:00.000","10000","FY2020","To fund operational expenses related to immigration services","264","519","DYCD"
"810","CT126020201408897","2019-07-01T00:00:00.000","2020-06-30T00:00:00.000","5000","FY2020","This program support Summer Day Camp","264","16","DYCD"
"811","CT126020201407786","2019-07-01T00:00:00.000","2020-06-30T00:00:00.000","9000","FY2020","Support the Youth Employment Training program","264","490","DYCD"
"813","CT126020201404368","2019-07-01T00:00:00.000","2020-06-30T00:00:00.000","64375","FY2020","To  support Leadership development prong for young women.","264","502","DYCD"
"814","CT126020201407687","2019-07-01T00:00:00.000","2020-06-30T00:00:00.000","25000","FY2020","This program  will support  the Food Pantry.","264","521","DYCD"
"815","CT112520201407417","2019-12-01T00:00:00.000","2021-06-30T00:00:00.000","687640","FY2020","PROVIDE SENIOR CENTER SERVICES TO OLDER ADULTS","464","398","DFTA"
"816","CT112520201407621","2019-12-01T00:00:00.000","2021-06-30T00:00:00.000","1495049","FY2020","PROVIDE SENIOR CENTER SERVICES TO OLDER ADULTS","464","522","DFTA"
"817","CT112520201407054","2019-12-01T00:00:00.000","2021-06-30T00:00:00.000","1537564","FY2020","PROVIDE SENIOR CENTER SERVICES TO OLDER ADULTS","464","388","DFTA"
"818","CT181620201407969","2019-07-01T00:00:00.000","2020-06-30T00:00:00.000","50000","FY2020","Afterschool recreation services children with ASD ages 6-12","297","302","DOHMH"
"819","CT126020201405766","2019-07-01T00:00:00.000","2020-06-30T00:00:00.000","45000","FY2020","Support Leadership Development Training f/Young Women/Girls.","264","226","DYCD"
"820","CT106920201409259","2019-07-01T00:00:00.000","2020-06-30T00:00:00.000","20000","FY2020","Provision of Immigrant Opportunities Initiative","120","165","DSS"
"821","CT126020201406466","2019-07-01T00:00:00.000","2020-06-30T00:00:00.000","15000","FY2020","To fund the Gun Hill Basketball League.","264","523","DYCD"
